comments,minutes,subreddit,time,title,yes_no,new_variable
59.0,1140.0,tattoos,19,"Book of Kells inspired fox and hare by Lauren Sleeper at Five Sirens in Dover, NH",0,2
5.0,360.0,BlackPeopleTwitte,6,Black Excellence™️,0,2
12.0,900.0,GeorgiaCampAndHike,15,Providence Canyon State Park,0,2
376.0,1200.0,AmateurRoomPorn,20,"The guy I hired to paint my home in Indianapolis, IN told my SO I ""would be sorry"" I asked for a black accent wall in the master bedroom. I'm not sorry!",1,2
39.0,540.0,MurderedByWords,9,Since we're counting,0,2
148.0,1140.0,wholesomememes,19,Friends from around the world,1,2
12.0,360.0,CorporateFacepalm,6,The guy in the header photo on TrumpDating.com is a Sex Offender,0,2
46.0,1200.0,BlackPeopleTwitte,20,2018 is the year for commitment 💍,0,2
4.0,240.0,BlackPeopleTwitte,4,That’s how grandpa stayed alive for the last 5 Years.,0,2
22.0,420.0,splatoon,7,I have lost every single Splatfest since the game came out:,0,2
217.0,1080.0,videos,18,"NASCAR driver's mom interrupts press conference, driver breaks down in tears",1,2
355.0,360.0,FortNiteBR,6,"I killed Ninja - he called me ""a dumbass"" and ""fucking stupid."" I think I can retire from Fortnite.",1,2
236.0,1200.0,WritingPrompts,20,"[WP] Finally, the ultimate MMORPG has been created, unlimited choice and room to grow and expand your character. There's just one issue, it's so realistic, nobody can remember which life they are living, and which is the game.",1,2
5.0,180.0,ScottishPeopleTwitte,3,Ex Boss,0,2
268.0,1260.0,Cyberpunk,21,Tokyo's infrastructure is so Blade Runner,1,2
23.0,420.0,nostalgia,7,Root beer barrels... my grandma always had them and gave them to me as a kid.,0,2
77.0,1200.0,funny,20,Going through my dads stuff and I found one of the most dad things I’ve ever seen.....,0,2
0.0,1200.0,UNBGBBIIVCHIDCTIICBG,20,Smooth AF.,0,2
1288.0,1320.0,gaming,22,"We had LAN Party over the weekend, haven't seen the sun for two days. It was EPIC!",1,2
51.0,840.0,NotKenM,14,Not Ken M on the US President(s),0,2
220.0,1200.0,itookapicture,20,ITAP of a boy waiting to be picked up,1,2
65.0,600.0,bjj,10,I've started making dumb clothes for BJJ and figured this sub might like 'em.,0,2
254.0,1080.0,The_Muelle,18,Robert Mueller Has Trump Cornered | HuffPost,1,2
121.0,1320.0,Atlanta,22,"Senator Perdue: Net Neutrality laws were ""monopoly-style regulations.""",1,2
8.0,480.0,shield,8,Seems legit,0,2
7.0,900.0,Zoomies,15,When the zoomies hit you out of nowhere (OC),0,2
304.0,1200.0,Jokes,20,A lot of Russian girls are trying to hook up with American guys online.,1,2
84.0,840.0,DungeonsAndDragons,14,"[DM] I found my favorite die! On attack crits, it gets thrown at the player",1,2
72.0,600.0,FireEmblemHeroes,10,"S-ranking floors 96-100 on Expert/Hard, but it’s just Hinata",0,2
4.0,300.0,splatoon,5,Gf and I had a Splatoon themed night in,0,2
241.0,900.0,elationship_advice,15,"(34M)What moment with your future wife made you think ""Yup, I'm asking this (28F)girl to marry me.""?",1,2
40.0,900.0,Atlanta,15,Anyone up for terrible golf?,0,2
3.0,420.0,RedditLaqueristas,7,"Finally, one worth posting! Peacock ombre with stamping",0,2
91.0,780.0,assholedesign,13,Pandora Won't Let You Skip a 73 minute Song,1,2
331.0,1140.0,zelda,19,Beat Majora’s Mask last night at 3:55 am and I’ve got to say it exceeded my expectations,1,2
10.0,540.0,Predators,9,Me and my buds after we score a goal,0,2
18.0,660.0,Military,11,My mate hates when people touch his bed so we took it and let a boot guard it.,0,2
159.0,1200.0,travel,20,"Mexican breakfast with a view [Los Cabos, Mexico]",1,2
6.0,420.0,ImaginaryBehemoths,7,Loki's Bastard Offspring (The Ritual) by Keith Thompson,0,2
103.0,900.0,BlackPeopleTwitte,15,Coming in with the house shoes on and belt in hand to embarrass you in front of everybody,1,2
36.0,780.0,BlackPeopleTwitte,13,Hot and fresh out of kitchens,0,2
129.0,720.0,antiMLM,12,Found this in an antimlm Facebook group I'm in.,1,2
83.0,540.0,listentothis,9,Mort Garson - Plantasia (Music for Plants) [electronic] (1976),1,2
94.0,1020.0,PrequelMemes,17,"Take a Snickers, young Skywalker. . .",1,2
154.0,900.0,FortNiteBR,15,Every time me and my mate drops snobby,1,2
103.0,900.0,todayilearned,15,"TIL: NPR CarTalk Tom Magliozzi's grave stone has ""It's not hard work that killed him"" inscribed in Latin.",1,2
29.0,720.0,DunderMifflin,12,Aren't we all?,0,2
65.0,780.0,trashy,13,My kid is less important then drinking,0,2
0.0,1140.0,UNBGBBIIVCHIDCTIICBG,19,Smooth AF.,0,2
75.0,840.0,shittyfoodporn,14,"Kraft dinner served on a coffee table, garnished with a tupperware box.",0,2
5.0,420.0,Breath_of_the_Wild,7,Breath of the Wild in one quote,0,2
274.0,1320.0,battlestations,22,Shoutout to everyone who can’t afford fancy lighting and desks,1,2
444.0,1260.0,Wellthatsucks,21,I tried to add almond milk to my coffee this morning,1,2
34.0,660.0,food,11,Egg wrapped in bacon [Pro/Chef],0,2
77.0,1200.0,funny,20,Going through my dads stuff and I found one of the most dad things I’ve ever seen.....,0,2
453.0,1140.0,pics,19,"Iran, 1979. Right before the islamic revolution",1,2
453.0,1140.0,pics,19,"Iran, 1979. Right before the islamic revolution",1,2
41.0,840.0,WatchandLearn,14,Building a rock arch,0,2
277.0,780.0,eddevils,13,"[Rival Watch] Manchester City have been eliminated from the FA Cup by Wigan, 1-0",1,2
174.0,1200.0,Justfuckmyshitup,20,Say no mo,1,2
43.0,720.0,streetwea,12,ask and you shall receive,0,2
35.0,360.0,funny,6,The legends are true.,0,2
19.0,480.0,BlueMidterm2018,8,I have not voted in years (I know!) because I live in a ruby red state. I will never allow that to happen again. Let's go!!!!!,0,2
93.0,720.0,history,12,The Lion of the Union: The Pelvic Wound of Joshua Lawrence Chamberlain -,1,2
93.0,1020.0,CrappyDesign,17,The windows on this building don’t line up,1,2
100.0,840.0,MMA,14,[Image/GIF] Jorge Masvidal's ridiculous takedown defense versus Benson Henderson,1,2
168.0,960.0,news,16,St. Petersburg set to rename main library after President Obama,1,2
38.0,360.0,PewdiepieSubmissions,6,new meme format. fight me,0,2
150.0,1260.0,PrequelMemes,21,Hello there,1,2
15.0,420.0,aww,7,"Reddit, welcome Scotchie into the world!",0,2
35.0,480.0,vinyl,8,My collection! 600 records and always growing...,0,2
7.0,1020.0,Atlanta,17,"Have a warehouse, barn or outdoor shelter? Adopt a working cat!",0,1
51.0,780.0,NotKenM,13,Not Ken M on the US President(s),0,2
13.0,660.0,oddlyterrifying,11,I will just leave this here...,0,2
52.0,1140.0,aww,19,"My dog Panda, he was still a handsome guy at 15",0,2
507.0,1140.0,CringeAnarchy,19,Guy compares Hillary to Jesus,1,2
49.0,1140.0,thalassophobia,19,Emerging from an underwater iceberg,0,2
490.0,1320.0,photoshopbattles,22,PsBattle: This web surfer,1,2
39.0,540.0,OnePiece,9,Found this and it made me laugh.,0,2
52.0,960.0,Prematurecelebration,16,Every day on my morning commute,0,2
251.0,1200.0,mildlyinteresting,20,Lucky Charms Frosted Flakes,1,2
213.0,720.0,CFB,12,Please roll back the Olympic theming,1,2
204.0,1320.0,KenM,22,Ken M wins big,1,2
7.0,900.0,Zoomies,15,When the zoomies hit you out of nowhere (OC),0,2
217.0,1080.0,videos,18,"NASCAR driver's mom interrupts press conference, driver breaks down in tears",1,2
1481.0,1260.0,pics,21,"Rep Mike Bost delivers a bag of ""thoughts and prayers"" to help with the Florida shooting.",1,2
45.0,480.0,Music,8,"No Doubt - Don't Speak [Alternative rock, Alternative/Indie, Pop] (1995)",0,2
10.0,540.0,stevenuniverse,9,"Just, everything about this one frame.",0,2
1.0,240.0,mechanical_gifs,4,Valentine Gear Sphere,0,2
371.0,1260.0,gaming,21,I realized this today and felt cripplingly old on the spot.,1,2
50.0,1020.0,OldSchoolCool,17,Stevie Nicks photographed by Steve Joester during a Fleetwood Mac concert at JFK Stadium in Philadelphia in 1978,0,2
58.0,1380.0,Superbowl,23,If Monday was an owl,0,2
8.0,900.0,aww,15,When the puppy has perfected the art of photobombing..... 😍🐶🐾📸,0,2
193.0,1380.0,funny,23,Boo,1,2
72.0,600.0,FireEmblemHeroes,10,"S-ranking floors 96-100 on Expert/Hard, but it’s just Hinata",0,2
304.0,1200.0,Jokes,20,A lot of Russian girls are trying to hook up with American guys online.,1,2
270.0,180.0,MovieDetails,3,"The Toothless animation for this scene in ""How to Train Your Dragon"" was modelled on one of the animators cat with tape stuck to it's tail",1,1
874.0,240.0,funny,4,Just Missed Seeing A Vampire This Morning,1,2
1668.0,240.0,gaming,4,We had an excess amount of copies that needed to be shipped back to the warehouse.,1,2
670.0,300.0,BlackPeopleTwitte,5,Idk how she does it.,1,2
131.0,120.0,evilbuildings,2,a cult classic,1,2
280.0,300.0,BlueMidterm2018,5,"Randy Bryce slams Paul Ryan for snubbing Florida teacher on gun control: ""We need a Speaker who will listen to everyone, not just the NRA and other special interests who cut him checks.""",1,2
553.0,240.0,ATBGE,4,LOL,1,2
421.0,360.0,BeAmazed,6,Skydiving with bird,1,2
176.0,300.0,marvelstudios,5,World record for time taken staring out a window.,1,2
257.0,420.0,wholesomememes,7,May we all experience happiness like this dog has,1,2
884.0,360.0,perfectloops,6,Please Bring Your Chairs And Tables To The Upright Position [L],1,2
313.0,240.0,quityourbullshit,4,Called out by life,1,2
86.0,300.0,blackpeoplegifs,5,Like no one is watching,1,2
52.0,360.0,woof_irl,6,woof irl,0,2
511.0,360.0,MurderedByWords,6,X-post from r/boottoobig but fits much better here,1,2
89.0,240.0,pics,4,A real Bigfoot,1,2
1964.0,420.0,space,7,Welcome to Mars - Real picture from Mars Rover,1,2
268.0,360.0,Tinde,6,I have a picture of me in the hospital and try to convince people of the most ridiculous reason for why I'm there when they ask. This is my favorite so far,1,2
384.0,360.0,madlads,6,absolute madness,1,2
113.0,300.0,wholesomebpt,5,Husband of the year,1,2
245.0,420.0,ChildrenFallingOve,7,Father of the year,1,2
1486.0,420.0,mildlyinteresting,7,My work continues the paint lines up the wall to help people park.,1,2
97.0,360.0,NintendoSwitch,6,I made a clay Tostarenan from Super Mario Odyssey!,1,2
688.0,360.0,LifeProTips,6,"LPT: Instead of using the phrase ""I assumed..."" use the phrase ""My understanding was...""",1,2
154.0,360.0,todayilearned,6,TIL Australian Don Ritchie talked at least 160 people out of committing suicide at Watson's Bay by offering them a cup of tea and someone to talk to. He was awarded a Medal of the Order of Australia for his efforts.,1,2
97.0,600.0,geek,10,Musk gets permission to do a little digging for his hyperloop,1,2
838.0,420.0,news,7,'A gender equality paradox': Countries with more gender equality have fewer female STEM grads,1,2
0.0,420.0,Atlanta,7,Midtown really has a gleam to it,0,2
32.0,360.0,thewalkingdead,6,Flew into Atlanta for a wedding- day trip to Alexandria / Woodbury!!,0,2
26.0,180.0,food,3,[Homemade] fresh fruit tart :),0,2
21.0,360.0,lot,6,Was unloading a truck at work the other day... Didn't realize it had been packed at Isenguard.,0,2
2.0,240.0,Atlanta,4,"Was on a roof on Peachtree St, I thought the view was nice.",0,2
2.0,360.0,Georgia,6,We need some help in Fairburn.,0,2
58.0,360.0,ComedyCemetery,6,Memes have a short lifespan,0,2
161.0,240.0,Showerthoughts,4,"Why do people say ""tuna fish"" when they don't say ""beef mammal"" or ""chicken bird""?",1,2
117.0,480.0,UnethicalLifeProTips,8,ULPT: Need a free Taxi ride? Tell the driver to go somewhere further away than your destination. When you are close to your destination tell them you have no money and you'll be kicked out at where you need to be!,1,2
48.0,360.0,CrappyDesign,6,Nothing Lines Up,0,2
141.0,360.0,videos,6,one of the most notorious endings in South Park,1,2
106.0,240.0,MonsterHunte,4,"Finally Killed Diablos, saved by my 8 yr old daughter.",1,2
49.0,300.0,MaliciousCompliance,5,You want your dog back RIGHT NOW? Ok,0,2
61.0,420.0,Music,7,Del tha Funky Homosapien - Mistadobalina [Hip Hop],0,2
30.0,420.0,MasterReturns,7,Henlo mom I lub you,0,2
73.0,840.0,aww,14,Two husky puppies meet for the first time at the vet's office,0,2
79.0,660.0,nottheonion,11,Where are the students? Manipur minister finds goats in classrooms on surprise visit,1,2
46.0,420.0,totallynotrobots,7,MY FRIEND TEACHING MY HOW TO ROLL A JOINT,0,2
108.0,780.0,CasualUK,13,Relatable,1,2
72.0,300.0,writing,5,"TIL James Joyce and Hemingway were drinking buddies and when the slight-of-stature Joyce ran into trouble he hid behind Hemingway and yelled “Deal with him, Hemingway. Deal with him.”",0,2
55.0,660.0,funny,11,I love Australian warning labels,0,2
125.0,300.0,Android,5,"The Pixel 2 charges much more slowly below certain temperatures, but it doesn't tell you that",1,2
12.0,240.0,puns,4,Grocery shopping,0,2
339.0,600.0,funny,10,"Oh, my God. How can I win?",1,2
174.0,600.0,starterpacks,10,The poor french city starterpack,1,2
39.0,300.0,notinteresting,5,Chile can actually go inside Chile,0,2
27.0,300.0,happycryingdads,5,"My wonderful, and VERY stoic, father losing his composure for just a second while pronouncing my older brother and beautiful sister-in-law as husband and wife. It is the only time in 28 years that I have ever seen him cry.",0,2
315.0,420.0,buildapc,7,I would like to warn everyone NOT to buy an MSI motherboard- the BIOS have been an absolute nightmare this past year and have yet to be fixed a year after release.,1,2
54.0,420.0,DnD,7,"[OC] Made a map for our home dungeon, just wanted to show",0,2
48.0,240.0,CollegeBasketball,4,Sutton's Reaction to Manley Checking In (Louisville/UNC),0,2
49.0,480.0,funny,8,"Stay safe, Godzilla",0,2
53.0,600.0,ArtefactPorn,10,"Researchers have identified the source of one of tiny fragments of paper found on board of the wreckage of Queen Anne’s Revenge – the flagship of the pirate Edward Teach, known better as Blackbeard. It was revealed to be from a 1712 first edition of a book by Capt. Edward Cooke. [762x800]",0,2
10.0,120.0,OldSchoolCool,2,Grandma rocking the red pantsuit 1990,0,2
68.0,900.0,HighQualityGifs,15,"When you have to fulfill the prophecy, but she wants the D.",0,2
15.0,240.0,funny,4,All is fair in food and war,0,2
43.0,480.0,funny,8,And also if you say 'not homo' than it's also not gay,0,2
196.0,360.0,FortNiteBR,6,Categorised most locations in Fortnite for the less informed.,1,1
22.0,600.0,YouSeeComrade,10,"You see comrade, this is the only show to learn true communist science",0,2
31.0,360.0,batman,6,"Standing in line practicing my greeting ""You are my Batman"", until the 8 people in front of me said the same thing. Don't worry guys, he knows!",0,2
44.0,300.0,Breath_of_the_Wild,5,My dad playing the first video game in his life,0,2
40.0,480.0,Showerthoughts,8,"When a clock battery dies, the clock records the time of its death.",0,2
8.0,240.0,sbubby,4,Sam is sad.,0,2
47.0,480.0,todayilearned,8,"TIL Benjamin Franklin wanted to make the odour of farts smell good so that farting in public will become socially acceptable. Ben wanted flatulence to be ""as agreeable as perfumes""",0,2
243.0,420.0,PublicFreakout,7,Self-Proclaimed “Satan’s Son” catches a quick two-piece KO,1,1
169.0,360.0,MonsterHunterWorld,6,I was following Anjanath around and found out that she likes to spend time on the cliffside to watch ocean hit the shores. Look how she sits like a good puppy she is. TIL I'm the real monster in Monster Hunter :-(,1,2
31.0,660.0,EarthPorn,11,"Sunset through the keyhole at Pfeiffer Beach, Big Sur. [OC] [2722x2178]",0,2
55.0,300.0,MechanicalKeyboards,5,"[photos] Walnut, brass and warm hues.",0,2
126.0,420.0,television,7,Let us The Soup fans rejoice it is back and hasn't missed a beat.,1,2
31.0,660.0,EarthPorn,11,"Sunset through the keyhole at Pfeiffer Beach, Big Sur. [OC] [2722x2178]",0,2
55.0,300.0,MechanicalKeyboards,5,"[photos] Walnut, brass and warm hues.",0,2
126.0,420.0,television,7,Let us The Soup fans rejoice it is back and hasn't missed a beat.,1,2
26.0,300.0,MachinePorn,5,"""Overland Train"" [1600 x 1281]",0,2
51.0,420.0,CrappyDesign,7,Papyrus and comic sans font together on a pink background?,0,2
1042.0,840.0,LifeProTips,14,"LPT: Bring candy on your plane trip, any sad kid can't cry next to you with Starbursts in his mouth",1,2
68.0,420.0,wallstreetbets,7,I...declare.... BANKRUPTCY!!!,0,2
130.0,540.0,NobodyAsked,9,Ummm.... Well done?,1,2
186.0,780.0,BetterEveryLoop,13,When you're ranked 43rd in the world and you unexpectedly win gold at the Olympics,1,2
47.0,780.0,ThingsCutInHalfPorn,13,Hedge [511 x 767],0,2
40.0,300.0,BlackPeopleTwitte,5,Guardians Of The Galaxy should've accurately depicted the Milky Way,0,2
157.0,480.0,forwardsfromgrandma,8,FWD: FWD: ATHEISTS CAUSE SHOOTINGS!,1,2
39.0,540.0,aww,9,So happy!,0,2
12.0,300.0,carporn,5,Cadillac Eldorado 67 [946 * 656],0,2
15.0,240.0,wokekids,4,Kids are the greatest thinkers of the 21st century,0,2
75.0,420.0,gaybros,7,"After yesterday's swim meet, I feel amazing. I swam the best meet of my life, and this is the first time I've been on a team that I can be totally open about my sexuality (this is a pic of my 6th place finish in the 100 fly with a time of 51.65)",0,2
19.0,420.0,PeopleFuckingDying,7,nOn TiCkEt HoLdErS tHrEaTeNeD wItH aSs RaPe HoLy ShIt,0,2
26.0,120.0,MilitaryGfys,2,M1A1 Abrams interior view,0,2
73.0,480.0,todayilearned,8,"TIL A man, Denver Lee St. Clair died after being subjected to an atomic wedgie by his 33 year old stepson",0,2
79.0,540.0,Art,9,"Stasis v1.3, Charcoal, Graphite, and Acrylic, 18x24""",1,2
81.0,300.0,YouShouldKnow,5,YSK : Credit cards with contactless payments have cumulative spending limits that are reset when you pay using your PIN.,1,2
117.0,780.0,FloridaMan,13,"Cops: Florida Man Googled ""How To Rob A Bank"" Before Robbing A Bank",1,2
29.0,360.0,smashbros,6,"Back in Smashcon 2016, my girlfriend made a series of posters for the convention that were used for the player showcase. Here is the completed album.",0,2
22.0,300.0,gameofthrones,5,[NO SPOILERS] I don't often drop the C-Bomb but Bronn is just so poetic it's hard not to quote...,0,2
30.0,360.0,Graffiti,6,Painted a faux neon piece yesterday,0,2
55.0,300.0,MechanicalKeyboards,5,"[photos] Walnut, brass and warm hues.",0,2
15.0,240.0,funny,4,All is fair in food and war,0,2
126.0,420.0,television,7,Let us The Soup fans rejoice it is back and hasn't missed a beat.,1,2
26.0,300.0,MachinePorn,5,"""Overland Train"" [1600 x 1281]",0,2
51.0,420.0,CrappyDesign,7,Papyrus and comic sans font together on a pink background?,0,2
31.0,660.0,EarthPorn,11,"Sunset through the keyhole at Pfeiffer Beach, Big Sur. [OC] [2722x2178]",0,2
1042.0,840.0,LifeProTips,14,"LPT: Bring candy on your plane trip, any sad kid can't cry next to you with Starbursts in his mouth",1,2
68.0,420.0,wallstreetbets,7,I...declare.... BANKRUPTCY!!!,0,2
130.0,540.0,NobodyAsked,9,Ummm.... Well done?,1,2
186.0,780.0,BetterEveryLoop,13,When you're ranked 43rd in the world and you unexpectedly win gold at the Olympics,1,2
27.0,300.0,happycryingdads,5,"My wonderful, and VERY stoic, father losing his composure for just a second while pronouncing my older brother and beautiful sister-in-law as husband and wife. It is the only time in 28 years that I have ever seen him cry.",0,2
169.0,360.0,MonsterHunterWorld,6,I was following Anjanath around and found out that she likes to spend time on the cliffside to watch ocean hit the shores. Look how she sits like a good puppy she is. TIL I'm the real monster in Monster Hunter :-(,1,2
47.0,780.0,ThingsCutInHalfPorn,13,Hedge [511 x 767],0,2
40.0,300.0,BlackPeopleTwitte,5,Guardians Of The Galaxy should've accurately depicted the Milky Way,0,2
157.0,480.0,forwardsfromgrandma,8,FWD: FWD: ATHEISTS CAUSE SHOOTINGS!,1,2
39.0,540.0,aww,9,So happy!,0,2
12.0,300.0,carporn,5,Cadillac Eldorado 67 [946 * 656],0,2
15.0,240.0,wokekids,4,Kids are the greatest thinkers of the 21st century,0,2
75.0,420.0,gaybros,7,"After yesterday's swim meet, I feel amazing. I swam the best meet of my life, and this is the first time I've been on a team that I can be totally open about my sexuality (this is a pic of my 6th place finish in the 100 fly with a time of 51.65)",0,2
19.0,420.0,PeopleFuckingDying,7,nOn TiCkEt HoLdErS tHrEaTeNeD wItH aSs RaPe HoLy ShIt,0,2
26.0,120.0,MilitaryGfys,2,M1A1 Abrams interior view,0,2
73.0,480.0,todayilearned,8,"TIL A man, Denver Lee St. Clair died after being subjected to an atomic wedgie by his 33 year old stepson",0,2
79.0,540.0,Art,9,"Stasis v1.3, Charcoal, Graphite, and Acrylic, 18x24""",1,2
81.0,300.0,YouShouldKnow,5,YSK : Credit cards with contactless payments have cumulative spending limits that are reset when you pay using your PIN.,1,2
117.0,780.0,FloridaMan,13,"Cops: Florida Man Googled ""How To Rob A Bank"" Before Robbing A Bank",1,2
73.0,480.0,todayilearned,8,"TIL A man, Denver Lee St. Clair died after being subjected to an atomic wedgie by his 33 year old stepson",0,2
79.0,540.0,Art,9,"Stasis v1.3, Charcoal, Graphite, and Acrylic, 18x24""",1,2
81.0,300.0,YouShouldKnow,5,YSK : Credit cards with contactless payments have cumulative spending limits that are reset when you pay using your PIN.,1,2
117.0,780.0,FloridaMan,13,"Cops: Florida Man Googled ""How To Rob A Bank"" Before Robbing A Bank",1,2
29.0,360.0,smashbros,6,"Back in Smashcon 2016, my girlfriend made a series of posters for the convention that were used for the player showcase. Here is the completed album.",0,2
22.0,300.0,gameofthrones,5,[NO SPOILERS] I don't often drop the C-Bomb but Bronn is just so poetic it's hard not to quote...,0,2
30.0,360.0,Graffiti,6,Painted a faux neon piece yesterday,0,2
1066.0,900.0,iamverybadass,15,Lots of badasses weighing in these days.,1,2
10.0,420.0,BikiniBottomTwitte,7,Reddit being Reddit,0,2
203.0,240.0,LivestreamFail,4,Disappointed father walks in on son dressed up as a maid,1,2
28.0,420.0,oddlysatisfying,7,The way my friend mowed his lawn.,0,2
171.0,900.0,gifs,15,Larry Nance Jr. recreates his father's dunk from 1984,1,2
1177.0,960.0,JusticeServed,16,"She threw her newborn baby in a dumpster. Now, she'll spend decades in prison.",1,2
56.0,480.0,absolutelynotme_irl,8,Absolutelynotme_irl,0,2
15.0,300.0,thecatdimension,5,The cat dimension needs me.,0,1
1045.0,240.0,AskReddit,4,What's something you regretted buying as soon as you walked out of the store?,1,2
9.0,360.0,arepuppers,6,Shibo doin a grow.,0,2
8.0,420.0,unstirredpaint,7,Black eye,0,2
12.0,240.0,interestingasfuck,4,Production and completed shots from Final Destination 5,0,2
1507.0,900.0,Documentaries,15,Filmmaker Alex Gibney investigates the fact that the 400 richest Americans control more wealth than the 150 million people in the bottom 50 percent of the population [CC] (2012) 59:03,1,2
103.0,420.0,nintendo,7,The Yiga Clan Is Pure Wasted Potential,1,2
28.0,420.0,WatchandLearn,7,Video How fiber optics work,0,2
91.0,420.0,Shitty_Car_Mods,7,This mid-life crisis starts with a Kacow,1,2
328.0,960.0,pics,16,Tunisian Protester holding A Sign That Says Grow The Brain Before The Beard,1,2
29.0,180.0,StarWars,3,The end battle between Anakin and Obi-Wan is so much more heartbreaking in the Matthew Stover “Revenge of the Sith” novel.,0,2
51.0,420.0,FrankOcean,7,RIP GUAC,0,2
9.0,420.0,Blep,7,Criminal mastermind caught blepping moments after launching attack on toes,0,2
7.0,420.0,thisismylifenow,7,I'm a railing meow,0,2
28.0,60.0,Prematurecelebration,1,\o/,0,2
13.0,420.0,WaltDisneyWorld,7,Looking out from the Contemporary yesterday afternoon °o°,0,2
15.0,720.0,aww,12,The sleepiest of all the puppers,0,2
351.0,600.0,britishproblems,10,"""Can I have a 5p bag with that?"". ""Sorry, we only do 10p bags now"". ""Alright then, can I have a 10p bag?"". ""Sorry, we've run out of them.""",1,2
25.0,240.0,TheLastAirbende,4,Korra + Whiplash,0,2
24.0,300.0,itookapicture,5,ITAP of a Japanese fire festival,0,2
32.0,480.0,pics,8,A great shirt that I saw,0,2
85.0,300.0,television,5,Netflix's 'The Joel McHale Show' With Joel McHale brings back just the right vehicle—for Joel McHale,1,2
21.0,360.0,FlashTV,6,DIS DOODE,0,2
42.0,720.0,standupshots,12,Fairytales are just SAD stories.,0,2
111.0,600.0,olympics,10,The Difference Between Gold and Silver in the 15km mass start Biathlon,1,2
50.0,780.0,mildlyinteresting,13,This picture frame is on a corner.,0,2
12.0,240.0,anime_irl,4,Anime_irl,0,2
41.0,480.0,EngineeringPorn,8,The Cockpit of Space Shuttle Columbia.,0,2
138.0,900.0,freefolk,15,"Her bio said ""Quote Game of Thrones to me""",1,2
12.0,240.0,Damnthatsinteresting,4,Larry Nance Jr recreating his father Larry Nance Sr's dunk from 1984.,0,2
1242.0,900.0,movies,15,'Blade Runner 2049' Wins Top Prize From American Society of Cinematographers,1,2
233.0,900.0,teenagers,15,Uh oh,1,2
52.0,540.0,PUBG,9,I need that 8x scope,0,2
1045.0,420.0,AskReddit,7,What’s a tiny thing that makes you happy?,1,2
29.0,120.0,news,2,Alabama sheriffs pocket tens of thousands of taxpayer dollars allocated to feed inmates,0,1
8.0,240.0,Atlanta,4,An empty road in Atlanta. Its been years,0,2
111.0,600.0,olympics,10,The Difference Between Gold and Silver in the 15km mass start Biathlon,1,2
50.0,780.0,mildlyinteresting,13,This picture frame is on a corner.,0,2
12.0,240.0,anime_irl,4,Anime_irl,0,2
41.0,480.0,EngineeringPorn,8,The Cockpit of Space Shuttle Columbia.,0,2
138.0,900.0,freefolk,15,"Her bio said ""Quote Game of Thrones to me""",1,2
12.0,240.0,Damnthatsinteresting,4,Larry Nance Jr recreating his father Larry Nance Sr's dunk from 1984.,0,2
1242.0,900.0,movies,15,'Blade Runner 2049' Wins Top Prize From American Society of Cinematographers,1,2
233.0,900.0,teenagers,15,Uh oh,1,2
52.0,540.0,PUBG,9,I need that 8x scope,0,2
1046.0,420.0,AskReddit,7,What’s a tiny thing that makes you happy?,1,2
29.0,120.0,news,2,Alabama sheriffs pocket tens of thousands of taxpayer dollars allocated to feed inmates,0,1
8.0,240.0,Atlanta,4,An empty road in Atlanta. Its been years,0,2
12.0,420.0,gardening,7,My blooming amaryllis I got for my birthday a few months ago.,0,2
35.0,780.0,AnimalsBeingDerps,13,He folded himself in half and fell asleep.,0,2
