comments,minutes,subreddit,time,title,yes_no,new_variable
327.0,600.0,trashy,10,"Man with sleeveless confederate flag shirt, with possum on shoulder outside a dollar general in FL",1,2
97.0,360.0,PUBATTLEGROUNDS,6,"When you have a crossbow in the lategame, you go big or you go home.",1,2
276.0,300.0,lgbt,5,From 1 year pre-transition to 1 year into transition. Sometimes I forget how much has changed. I feel so much more at peace.,1,2
23.0,480.0,firstworldanarchists,8,Fuck you sign!,0,2
92.0,420.0,holdmycatnip,7,HMC while I rip this catpost apart.,1,1
140.0,420.0,Cyberpunk,7,Train station in China,1,2
841.0,480.0,pics,8,"Living in a fairly ""white"" town in redneck Indiana, it was refreshing to see this dude at Black Panther last night.",1,2
57.0,300.0,BestOfReports,5,Mods block critically important information.,0,2
312.0,720.0,oddlysatisfying,12,Clearing a stack of skateboards.,1,2
498.0,360.0,worldnews,6,"Donald Trump acknowledges Russia's 'anti-US campaign' in unprecedented statement: ""'Russia started their anti-US campaign in 2014, long before I announced that I would run for President,' Mr Trump writes""",1,2
121.0,240.0,Showerthoughts,4,Whining about having a jet lag is quite literally like complaining that the world does not revolve around us.,1,2
544.0,600.0,philosophy,10,How we forgot the collective good—and started thinking of ourselves primarily as consumers,1,2
15.0,300.0,dankchristianmemes,5,Philippians 4:13,0,2
1677.0,720.0,Futurology,12,Should we give up half of the Earth to wildlife? Populations of all kinds of wildlife are declining at alarming speed. One radical solution is to make 50% of the planet a nature reserve by 2050.,1,2
48.0,480.0,2meirl4meirl,8,2meirl4meirl,0,2
53.0,360.0,TrumpCriticizesTrump,6,"I am not angry at Russia (or China) because their leaders are far smarter than ours. We need real leadership, and fast,before it is too late 6:20 AM - 6 Sep 2013",0,2
76.0,660.0,aww,11,A rare sighting of the North American Snow Loaf.,0,2
50.0,360.0,AbandonedPorn,6,"Oktyabr'skiy, Kamchatka [960x720]",0,2
362.0,660.0,funny,11,If EA made Park benches,1,2
48.0,480.0,2meirl4meirl,8,2meirl4meirl,0,2
56.0,300.0,StoppedWorking,5,Kitty_systems just crashed,0,2
148.0,600.0,memes,10,Sperm bank,1,2
41.0,540.0,hmmm,9,hmmm,0,2
143.0,240.0,MurderedByWords,4,I’ll just leave this here...,1,2
21.0,180.0,anime_irl,3,Anime irl,0,2
449.0,720.0,TwoXChromosomes,12,Emma Watson donates £1 million to help fund for sexual harassment victims.,1,2
37.0,300.0,eactiongifs,5,"MRW the hottest girl I know spins the bottle and lets out an audible groan as, miraculously, it lands on me",0,2
105.0,360.0,funny,6,"Imagine your midlife crisis, Kachow",1,2
28.0,180.0,Meditation,3,Happiness,0,2
456.0,420.0,todayilearned,7,"TIL about the Berlin Conference in 1884. 14 European countries held a 6 month long conference to formally divide Africa, so they an invade, overthrow existing governments, and pillage without fighting among each other. By 1902 90% of the continent was owned by European countries.",1,2
8.0,360.0,EarthPorn,6,Coast of Maine sunrise [OC 2340 x 2340],0,2
2961.0,420.0,AskReddit,7,What are tech myths you can’t believe people still believe in?,1,2
119.0,480.0,MURICA,8,Portugal really knows how to make you feel at home,1,2
62.0,300.0,TheDepthsBelow,5,Sea Cucumber in the Mariana Trench,0,2
736.0,720.0,facepalm,12,Penta - 5 points,1,2
275.0,780.0,NatureIsFuckingLit,13,This Blue Mycean Mushroom is fucking 🔥,1,2
201.0,480.0,gatekeeping,8,Steak keeping,1,2
173.0,660.0,WritingPrompts,11,"[WP] You used to play a fantasy MMORPG that wasn't very popular, so you were able to take the simple name of 'Dave'. When you return to the game (now massively popular), you discover that there is now a Church of 'Dave'.",1,2
31.0,600.0,oddlysatisfying,10,This Kitty Sleeping on a Force Field,0,2
52.0,360.0,pics,6,Burnt basement window. Took this while digging through the remains of my parents house after a fire that destroyed their house and killed my dad. But I guess there is beauty everywhere.,0,2
173.0,660.0,WritingPrompts,11,"[WP] You used to play a fantasy MMORPG that wasn't very popular, so you were able to take the simple name of 'Dave'. When you return to the game (now massively popular), you discover that there is now a Church of 'Dave'.",1,2
31.0,600.0,oddlysatisfying,10,This Kitty Sleeping on a Force Field,0,2
52.0,360.0,pics,6,Burnt basement window. Took this while digging through the remains of my parents house after a fire that destroyed their house and killed my dad. But I guess there is beauty everywhere.,0,2
37.0,60.0,OldSchoolCool,1,"A Native American child being raised by a white family - 1875. It was a rarity that the Indian children were actually treated as members of the family and not as slaves. Her style, and the fact that she was photographed indicate that she was actually loved and wanted.",0,1
81.0,600.0,PeopleFuckingDying,10,DeATH CaME TO CoLLeCT YoUR SoUL,1,2
257.0,300.0,IAmA,5,"I am Oscar Scafidi, in July 2016 I kayaked and hiked 1300km along Angola's longest river. Hippo attacks, arrested at gunpoint, sinking in rapids: AMA!",1,2
86.0,300.0,awwwtf,5,This fish's lips look human,1,2
201.0,420.0,mallninjashit,7,Meal Team 6 Starts the search for a new doody gun,1,2
95.0,420.0,food,7,[Homemade] Lasagna w/ homemade sauce,1,2
35.0,300.0,NotMyJob,5,"Printed the packaging, boss!",0,2
829.0,420.0,science,7,"AAAS AMA: Hi, we’re researchers from Google, Microsoft, and Facebook who study Artificial Intelligence. Ask us anything!",1,2
155.0,540.0,dadjokes,9,"Do you remember when you were a kid and whenever you cried, your parents would say, “I’ll give you a reason to cry!?""",1,2
52.0,360.0,CityPorn,6,A street in one of the oldest neighborhoods of Boston [OC][3000x2000],0,2
14.0,300.0,Thisismylifemeow,5,I ordered Sashimi not Sushi. Fix this right meow!,0,2
39.0,480.0,upaulsdragrace,8,"I mean, same.",0,2
137.0,600.0,DiWHY,10,And all i really wanted was another chair,1,2
114.0,240.0,GetMotivated,4,"[Text]Don't Bend ; Don't water it down; Don't try to make it logical; Don't edit your own soul according to the fashion. Rather, follow your most intense obsessions mercilessly -- FRANZ KAFKA",1,2
33.0,360.0,StrangerThings,6,WHAT IF DAVID PLAYS IN SEASON 3 AS ELEVEN,0,2
28.0,180.0,aww,3,a miniature cow,0,2
174.0,480.0,TheSimpsons,8,Assault weapons have gotten a lot of bad press lately but they're manufactured for a reason...,1,2
147.0,600.0,therewasanattempt,10,to make fancy windows,1,2
31.0,180.0,mechanical_gifs,3,Astronomical Skeleton Clock,0,2
51.0,480.0,Showerthoughts,8,Elon Musk is equally famous for having developed a vehicle with no fuel tank and a vehicle with the largest fuel tank in the world.,0,2
94.0,240.0,Justrolledintotheshop,4,Vehicle had low wiper fluid pressure and I couldn't figure out why. Storm rolled in and helped me troubleshoot.,1,2
76.0,660.0,aww,11,A perfect fit...,0,2
413.0,840.0,chemicalreactiongifs,14,Creating plasma in a microwave oven.,1,2
408.0,660.0,television,11,Does anybody remember Beyond Belief- fact or fiction,1,2
120.0,720.0,softwaregore,12,Processor shall now slowly reverse everything that it processed,1,2
8.0,420.0,dogpictures,7,Snuggly boys,0,2
55.0,540.0,pics,9,"Took a picture from the top of Mt Bromo, Indonesia that I thought you lot might like...",0,2
173.0,720.0,nostalgia,12,MSN Messenger,1,2
18.0,300.0,LateStageCapitalism,5,"You told us “the freer the market, the freer the people...",0,2
42.0,360.0,forbiddensnacks,6,The forbidden pushpop,0,2
331.0,720.0,gaming,12,Buddy had a kid. We miss him,1,2
136.0,720.0,StarWars,12,My collection of Apple Watch Star Wars Live Photos/Faces,1,2
26.0,300.0,HistoryMemes,5,I'm an educated man,0,1
88.0,480.0,gay_irl,8,gay_irl,1,2
32.0,240.0,PrequelMemes,4,How we can get the right Obi-Wan,0,2
7.0,240.0,Art,4,"“Copper” oil on masonite, 8x10",0,2
81.0,600.0,ScottishPeopleTwitte,10,Out me fuckin way,1,2
44.0,420.0,sadcringe,7,The Wrong Drake,0,2
298.0,600.0,cringepics,10,It's just biology...,1,2
11.0,180.0,shittyreactiongifs,3,MRW someone asks me why I'm scratching my tit,0,2
48.0,480.0,Art,8,"Alpha, watercolors, 12x16""",0,2
53.0,240.0,dragonballfighterz,4,#16's Opinion on Bardock,0,2
11.0,1140.0,Atlanta,19,Crossing Peachtree [OC],0,2
19.0,180.0,barkou,3,Cutting it close,0,2
30.0,360.0,funny,6,Friends congratulated me on getting into a psych PhD with Freud cookies,0,2
1707.0,360.0,AskReddit,6,What do you wish was more socially acceptable?,1,2
28.0,420.0,funny,7,love is blind,0,2
55.0,540.0,pics,9,"Took a picture from the top of Mt Bromo, Indonesia that I thought you lot might like...",0,2
173.0,720.0,nostalgia,12,MSN Messenger,1,2
18.0,300.0,LateStageCapitalism,5,"You told us “the freer the market, the freer the people...",0,2
42.0,360.0,forbiddensnacks,6,The forbidden pushpop,0,2
331.0,720.0,gaming,12,Buddy had a kid. We miss him,1,2
136.0,720.0,StarWars,12,My collection of Apple Watch Star Wars Live Photos/Faces,1,2
26.0,300.0,HistoryMemes,5,I'm an educated man,0,1
88.0,480.0,gay_irl,8,gay_irl,1,2
32.0,240.0,PrequelMemes,4,How we can get the right Obi-Wan,0,2
7.0,240.0,Art,4,"“Copper” oil on masonite, 8x10",0,2
81.0,600.0,ScottishPeopleTwitte,10,Out me fuckin way,1,2
44.0,420.0,sadcringe,7,The Wrong Drake,0,2
298.0,600.0,cringepics,10,It's just biology...,1,2
11.0,180.0,shittyreactiongifs,3,MRW someone asks me why I'm scratching my tit,0,2
48.0,480.0,Art,8,"Alpha, watercolors, 12x16""",0,2
53.0,240.0,dragonballfighterz,4,#16's Opinion on Bardock,0,2
11.0,1140.0,Atlanta,19,Crossing Peachtree [OC],0,2
19.0,180.0,barkou,3,Cutting it close,0,2
30.0,360.0,funny,6,Friends congratulated me on getting into a psych PhD with Freud cookies,0,2
1707.0,360.0,AskReddit,6,What do you wish was more socially acceptable?,1,2
28.0,420.0,funny,7,love is blind,0,2
327.0,540.0,askscience,9,"Does a Mayfly, which only lives a day, evolve fast than a human?",1,2
24.0,360.0,EarthPorn,6,England's deepest lake (Wastwater) and highest mountain (Scafell Pike) (OC) [1024x683],0,2
127.0,540.0,DDLC,9,so act 2 called again...,1,2
56.0,180.0,todayilearned,3,"TIL the scientist John von Neumann (1903-1957) could by the age of 6, divide two 8 digit numbers in his head and converse in ancient Greek. He published over 150 papers during his lifetime, and is considered by many to be among the most intellegent humans to have ever lived.",0,2
42.0,840.0,TooMeIrlForMeIrl,14,ToomeirlFormeirl,0,2
269.0,300.0,baseball,5,"TIL if you turned all of Barry Bonds' singles into outs, he'd still have a higher OPS(.737) than HOF Phil Rizzuto (.707) and Brooks Robinson (.723)",1,2
12.0,240.0,puns,4,Grocery shopping,0,2
142.0,240.0,Showerthoughts,4,"Why do people say ""tuna fish"" when they don't say ""beef mammal"" or ""chicken bird""?",1,2
165.0,540.0,Libertarian,9,Hero that stopped a mass shooting in turn shot by police. This needs visibility. He deserves for people to know.,1,2
1309.0,900.0,CringeAnarchy,15,Last Black Panther post.,1,2
75.0,300.0,YouShouldKnow,5,YSK : Credit cards with contactless payments have cumulative spending limits that are reset when you pay using your PIN.,0,2
237.0,420.0,PublicFreakout,7,Self-Proclaimed “Satan’s Son” catches a quick two-piece KO,1,1
30.0,300.0,Graffiti,5,Painted a faux neon piece yesterday,0,2
8.0,420.0,unstirredpaint,7,Black eye,0,2
55.0,480.0,antiMLM,8,I can always tell when one of my friends turns to the dark side,0,2
72.0,360.0,insanepeoplefacebook,6,"I made a Bingo for this thread, try it out!",0,2
50.0,360.0,Wellworn,6,Found these two at a thrift store. Must have been the same owner. (Same waist/inseem),0,2
98.0,360.0,CFB,6,"Iowa State OL Sean Foster arrested and charged for being a minor in bar, interfering with officers",1,2
27.0,360.0,WatchandLearn,6,Video How fiber optics work,0,2
160.0,1020.0,eactiongifs,17,MRW I walk into a room and see my wife with paint sample books for our new place,1,2
936.0,240.0,AskReddit,4,What's something you regretted buying as soon as you walked out of the store?,1,2
77.0,540.0,Art,9,"Stasis v1.3, Charcoal, Graphite, and Acrylic, 18x24""",0,2
39.0,420.0,aww,7,Box of assorted frens,0,2
58.0,960.0,hmmm,16,hmmm,0,2
51.0,420.0,FrankOcean,7,RIP GUAC,0,2
40.0,480.0,EngineeringPorn,8,The Cockpit of Space Shuttle Columbia.,0,2
13.0,420.0,WaltDisneyWorld,7,Looking out from the Contemporary yesterday afternoon °o°,0,2
343.0,600.0,britishproblems,10,"""Can I have a 5p bag with that?"". ""Sorry, we only do 10p bags now"". ""Alright then, can I have a 10p bag?"". ""Sorry, we've run out of them.""",1,2
8.0,240.0,sbubby,4,Sam is sad.,0,2
94.0,420.0,MilitaryPorn,7,Headed to the field. Good ole 50 cal,1,2
380.0,600.0,science,10,"Teens work very hard to create a favorable online image through careful selection of which photos, activities and links to post on Facebook and Instagram, according to a recent study. Content that makes them appear interesting, well-liked and attractive to their friends and peers is a primary goal.",1,2
89.0,240.0,FireEmblemHeroes,4,Daddy's Girls,1,2
61.0,300.0,VaporwaveAesthetics,5,c h i c a g o,0,2
207.0,720.0,WeWantPlates,12,"My basket of chicken wings, not quite what I expected.",1,2
11695.0,600.0,AskReddit,10,"American gun owners of Reddit who have moved to a country with strict gun-control, what has this been like, what are the differences?",1,2
56.0,300.0,gaming,5,Let’s go Pokémon Rumble,0,2
797.0,600.0,books,10,"If the decline of Barnes and Nobel depresses you, check out Waterstones, a UK book seller which is going from strength to strength.",1,2
245.0,780.0,trippinthroughtime,13,Finding a guy like you,1,2
1561.0,540.0,AskReddit,9,"People who found the reddit account of people they know in real life, what's the weirdest/most shocking thing you found in their profile?",1,2
89.0,600.0,natureismetal,10,A kudu,1,2
68.0,420.0,loseit,7,"TIL that the higher your BMI your brain experiences less ""reward"" (dopamine) from eating. The highest BMIs got the smallest satisfaction from eating.",0,2
18.0,180.0,happy,3,I'm getting married to this amazing woman today!,0,2
413.0,840.0,chemicalreactiongifs,14,Creating plasma in a microwave oven.,1,2
409.0,660.0,television,11,Does anybody remember Beyond Belief- fact or fiction,1,2
120.0,720.0,softwaregore,12,Processor shall now slowly reverse everything that it processed,1,2
8.0,420.0,dogpictures,7,Snuggly boys,0,2
55.0,540.0,pics,9,"Took a picture from the top of Mt Bromo, Indonesia that I thought you lot might like...",0,2
173.0,720.0,nostalgia,12,MSN Messenger,1,2
18.0,300.0,LateStageCapitalism,5,"You told us “the freer the market, the freer the people...",0,2
42.0,360.0,forbiddensnacks,6,The forbidden pushpop,0,2
331.0,720.0,gaming,12,Buddy had a kid. We miss him,1,2
136.0,720.0,StarWars,12,My collection of Apple Watch Star Wars Live Photos/Faces,1,2
26.0,300.0,HistoryMemes,5,I'm an educated man,0,1
88.0,480.0,gay_irl,8,gay_irl,1,2
23.0,420.0,likeus,7,A young wild monkey is welcomed back by his family when he is released after 3 weeks of treatment for a leg injury,0,2
66.0,300.0,blunderyears,5,As a kid I refused to take a photo without holding something weird and making a dumb face..,0,2
138.0,900.0,freefolk,15,"Her bio said ""Quote Game of Thrones to me""",1,2
231.0,900.0,teenagers,15,Uh oh,1,2
978.0,420.0,AskReddit,7,What’s a tiny thing that makes you happy?,1,2
29.0,300.0,DesignPorn,5,The parking lines of this parking garage,0,2
8.0,240.0,Atlanta,4,An empty road in Atlanta. Its been years,0,2
21.0,180.0,StarWars,3,The end battle between Anakin and Obi-Wan is so much more heartbreaking in the Matthew Stover “Revenge of the Sith” novel.,0,2
25.0,480.0,Art,8,"Sir Mr. Tweety, oil on canvas, 4 x 4""",0,2
28.0,360.0,Naturewasmetal,6,Skeleton of a 28ft anaconda,0,2
7.0,420.0,thisismylifenow,7,I'm a railing meow,0,2
22.0,120.0,food,2,[Homemade] fresh fruit tart :),0,2
47.0,540.0,PUBG,9,I need that 8x scope,0,2
53.0,420.0,absolutelynotme_irl,7,Absolutelynotme_irl,0,2
400.0,960.0,insanepeoplefacebook,16,Atheists cause shootings...,1,2
25.0,420.0,oddlysatisfying,7,The way my friend mowed his lawn.,0,2
140.0,960.0,Art,16,"Leaf Octopus, Alex Konstad, Digital art, 2016.",1,2
149.0,120.0,worldnews,2,Top U.S. officials tell the world to ignore Trump’s tweets,1,2
35.0,780.0,AnimalsBeingDerps,13,He folded himself in half and fell asleep.,0,2
11.0,180.0,interestingasfuck,3,Production and completed shots from Final Destination 5,0,2
15.0,960.0,Atlanta,16,Parked my car and saw this in front of me.,0,2
33.0,600.0,BlackPeopleTwitte,10,fuck mint chocolate,0,2
453.0,960.0,gifs,16,"Surprise, motherfucker!",1,2
29.0,360.0,disney,6,Decided to use my favorite Disney character for my first stained glass design.,0,2
12.0,240.0,anime_irl,4,Anime_irl,0,2
936.0,240.0,AskReddit,4,What's something you regretted buying as soon as you walked out of the store?,1,2
39.0,420.0,aww,7,Box of assorted frens,0,2
58.0,960.0,hmmm,16,hmmm,0,2
51.0,420.0,FrankOcean,7,RIP GUAC,0,2
23.0,420.0,likeus,7,A young wild monkey is welcomed back by his family when he is released after 3 weeks of treatment for a leg injury,0,2
40.0,480.0,EngineeringPorn,8,The Cockpit of Space Shuttle Columbia.,0,2
66.0,300.0,blunderyears,5,As a kid I refused to take a photo without holding something weird and making a dumb face..,0,2
13.0,420.0,WaltDisneyWorld,7,Looking out from the Contemporary yesterday afternoon °o°,0,2
343.0,600.0,britishproblems,10,"""Can I have a 5p bag with that?"". ""Sorry, we only do 10p bags now"". ""Alright then, can I have a 10p bag?"". ""Sorry, we've run out of them.""",1,2
8.0,240.0,sbubby,4,Sam is sad.,0,2
88.0,420.0,Shitty_Car_Mods,7,This mid-life crisis starts with a Kacow,1,2
24.0,180.0,TheLastAirbende,3,Korra + Whiplash,0,2
91.0,540.0,techsupportgore,9,“It still works!”,1,2
58.0,180.0,FortNiteBR,3,Bullet drop guide for snipers in Fortnite. Decided to create one in picture format after watching loads of Youtube guides.,0,2
34.0,300.0,CFB,5,The 23 steps of pretty much any NCAA invesgation,0,2
20.0,300.0,FlashTV,5,DIS DOODE,0,2
14.0,720.0,aww,12,The sleepiest of all the puppers,0,2
17.0,480.0,arepuppers,8,"Update: wise O L D B O Y E no longer sick, home for nappies and head scriches :)",0,2
5.0,360.0,ImaginaryLandscapes,6,Abandoned Station by Florent Lebrun,0,2
109.0,540.0,olympics,9,The Difference Between Gold and Silver in the 15km mass start Biathlon,1,2
16.0,240.0,starterpacks,4,The starterpack for everything,0,2
9.0,360.0,Floof,6,Got home one day and June was staring at me like this. Guess I woke her up?,0,2
9.0,420.0,Blep,7,Criminal mastermind caught blepping moments after launching attack on toes,0,2
50.0,780.0,mildlyinteresting,13,This picture frame is on a corner.,0,2
39.0,660.0,standupshots,11,Fairytales are just SAD stories.,0,2
48.0,480.0,funny,8,"Stay safe, Godzilla",0,2
1037.0,840.0,LifeProTips,14,"LPT: Bring candy on your plane trip, any sad kid can't cry next to you with Starbursts in his mouth",1,2
41.0,420.0,todayilearned,7,"TIL Benjamin Franklin wanted to make the odour of farts smell good so that farting in public will become socially acceptable. Ben wanted flatulence to be ""as agreeable as perfumes""",0,2
153.0,480.0,forwardsfromgrandma,8,FWD: FWD: ATHEISTS CAUSE SHOOTINGS!,1,2
125.0,540.0,NobodyAsked,9,Ummm.... Well done?,1,2
11.0,420.0,BetterEveryLoop,7,How corgi's are created,0,2
45.0,240.0,CollegeBasketball,4,Sutton's Reaction to Manley Checking In (Louisville/UNC),0,2
46.0,780.0,ThingsCutInHalfPorn,13,Hedge [511 x 767],0,2
15.0,240.0,wokekids,4,Kids are the greatest thinkers of the 21st century,0,2
174.0,720.0,BetterEveryLoop,12,When you're ranked 43rd in the world and you unexpectedly win gold at the Olympics,1,2
19.0,420.0,PeopleFuckingDying,7,nOn TiCkEt HoLdErS tHrEaTeNeD wItH aSs RaPe HoLy ShIt,0,2
30.0,660.0,EarthPorn,11,"Sunset through the keyhole at Pfeiffer Beach, Big Sur. [OC] [2722x2178]",0,2
42.0,480.0,funny,8,And also if you say 'not homo' than it's also not gay,0,2
293.0,360.0,buildapc,6,I would like to warn everyone NOT to buy an MSI motherboard- the BIOS have been an absolute nightmare this past year and have yet to be fixed a year after release.,1,2
37.0,240.0,notinteresting,4,Chile can actually go inside Chile,0,2
29.0,360.0,smashbros,6,"Back in Smashcon 2016, my girlfriend made a series of posters for the convention that were used for the player showcase. Here is the completed album.",0,2
19.0,240.0,gameofthrones,4,[NO SPOILERS] I don't often drop the C-Bomb but Bronn is just so poetic it's hard not to quote...,0,2
120.0,360.0,television,6,Let us The Soup fans rejoice it is back and hasn't missed a beat.,1,2
1050.0,900.0,iamverybadass,15,Lots of badasses weighing in these days.,1,2
23.0,240.0,happycryingdads,4,"My wonderful, and VERY stoic, father losing his composure for just a second while pronouncing my older brother and beautiful sister-in-law as husband and wife. It is the only time in 28 years that I have ever seen him cry.",0,2
114.0,780.0,FloridaMan,13,"Cops: Florida Man Googled ""How To Rob A Bank"" Before Robbing A Bank",1,2
17.0,180.0,aww,3,They are both confused,0,2
14.0,180.0,aww,3,One day that yawn will be fierce.,0,2
75.0,420.0,gaybros,7,"After yesterday's swim meet, I feel amazing. I swam the best meet of my life, and this is the first time I've been on a team that I can be totally open about my sexuality (this is a pic of my 6th place finish in the 100 fly with a time of 51.65)",0,2
54.0,300.0,MechanicalKeyboards,5,"[photos] Walnut, brass and warm hues.",0,2
149.0,120.0,worldnews,2,Top U.S. officials tell the world to ignore Trump’s tweets,1,2
35.0,780.0,AnimalsBeingDerps,13,He folded himself in half and fell asleep.,0,2
11.0,180.0,interestingasfuck,3,Production and completed shots from Final Destination 5,0,2
15.0,960.0,Atlanta,16,Parked my car and saw this in front of me.,0,2
33.0,600.0,BlackPeopleTwitte,10,fuck mint chocolate,0,2
453.0,960.0,gifs,16,"Surprise, motherfucker!",1,2
29.0,360.0,disney,6,Decided to use my favorite Disney character for my first stained glass design.,0,2
12.0,240.0,anime_irl,4,Anime_irl,0,2
4.0,300.0,meirl,5,meirl,0,2
35.0,360.0,BlackPeopleTwitte,6,Haters will say it’s fake,0,2
34.0,600.0,Astronomy,10,"Halley's Comet... May 15, 1910",0,2
43.0,660.0,CatsStandingUp,11,Cat.,0,1
8.0,120.0,HistoryPorn,2,"Amelia Earhart - London, 1928 [1200 × 935]",0,2
55.0,360.0,noisygifs,6,Bumpy to smooth,0,2
22.0,120.0,MilitaryGfys,2,M1A1 Abrams interior view,0,2
31.0,480.0,pics,8,A great shirt that I saw,0,2
161.0,900.0,WhitePeopleTwitte,15,Psychological humor,1,2
23.0,420.0,technology,7,"Cyberattacks are the single greatest threat to global stability, German defense minister says - Recent cyberattacks have shown that sensitive and personal data have become the target to destabilize companies and governments worldwide.",0,2
23.0,300.0,itookapicture,5,ITAP of a Japanese fire festival,0,2
5.0,240.0,likeus,4,Proof that dogs love children in a parental bond!,0,2
10.0,420.0,gardening,7,My blooming amaryllis I got for my birthday a few months ago.,0,2
141.0,900.0,gifsthatkeepongiving,15,Piping skills,1,2
85.0,540.0,CringeAnarchy,9,“2018 is a gays only event”,1,2
71.0,720.0,MonsterHunte,12,Made a legiana helmet,0,2
25.0,360.0,funny,6,Buzz Lightbeer,0,2
34.0,240.0,CringeAnarchy,4,we gotta be on the place of black people to understand how opressed they truly are,0,2
13.0,360.0,EarthPorn,6,Havasu Falls and its turquoise water [OC][3000x2000],0,2
141.0,360.0,coolguides,6,A guide of where electrical outlets come from,1,2
17.0,420.0,misleadingthumbnails,7,"Two, mint condition Barbies, in original boxes",0,2
78.0,300.0,television,5,Netflix's 'The Joel McHale Show' With Joel McHale brings back just the right vehicle—for Joel McHale,0,2
10.0,300.0,starterpacks,5,Build-A Fuckboy Starter Pack Starter Pack,0,2
89.0,420.0,DDLC,7,"""I-I'm not flat! Baka!""",1,2
18.0,240.0,Simulated,4,They See Me Rollin,0,2
70.0,360.0,marvelstudios,6,Nah I’m just feelin it,0,2
35.0,360.0,MealPrepSunday,6,Did someone say Burrito Bowls? Burrito Bowls.,0,2
14.0,240.0,tumbl,4,strangely accurate,0,2
23.0,480.0,gifs,8,"""Hey, do you have a treat for me?""",0,2
35.0,300.0,BigCatGifs,5,When you got no friends.,0,2
23.0,240.0,PenmanshipPorn,4,"Pretty Neat, Right?",0,2
9.0,120.0,food,2,[Homemade] Donuts filled with vanilla and chocolate pastry cream and spiced pear compote,0,2
12.0,240.0,surrealmemes,4,"Ca ution! P are nts ,, mu st rea d!!",0,2
84.0,240.0,movies,4,"First Image from Thriller 'In Darkness' - Starring Natalie Dormer, Ed Skrein, and Emily Ratajkowski",1,2
91.0,960.0,anime_irl,16,Anime_irl,1,2
11.0,180.0,todayilearned,3,"TIL of Brian Spencer, a former NHL hockey player who's father, upon hearing his son was starting in his first game, held a Canadian TV station hostage and forced them to broadcast it, before being shot and killed. After his career, Brian too was shot & killed during a robbery after buying crack.",0,2
15.0,180.0,BlackPeopleTwitte,3,The Joker put in that work (work work work work work).,0,2
56.0,960.0,pics,16,"Friend of mine who's been living in Japan for the last 16+ years has become a pretty serious amateur photographer. I keep telling him to post on here, it's some amazing shots.",0,2
47.0,180.0,marvelstudios,3,Did you notice the many similarities between Black Panther and The Lion King?,0,2
47.0,600.0,gaming,10,The correct way to play Fight Night Champion,0,2
6.0,180.0,aww,3,Woodsie loves cheeseburgers,0,2
317.0,1020.0,Damnthatsinteresting,17,How fiber optics work,1,2
58.0,180.0,FortNiteBR,3,Bullet drop guide for snipers in Fortnite. Decided to create one in picture format after watching loads of Youtube guides.,0,2
34.0,300.0,CFB,5,The 23 steps of pretty much any NCAA invesgation,0,2
20.0,300.0,FlashTV,5,DIS DOODE,0,2
14.0,720.0,aww,12,The sleepiest of all the puppers,0,2
17.0,480.0,arepuppers,8,"Update: wise O L D B O Y E no longer sick, home for nappies and head scriches :)",0,2
5.0,360.0,ImaginaryLandscapes,6,Abandoned Station by Florent Lebrun,0,2
