comments,minutes,subreddit,time,title,yes_no,new_variable
1158.0,480.0,OldSchoolCool,8,"An actual photo of Theodore Roosevelt and John Muir at Yosemite, 1903",1,2
1360.0,600.0,GetMotivated,10,"[Image] Found a note from 2 months ago, made a few updates",1,2
853.0,480.0,MurderedByWords,8,Unarmed man murdered by 4 killers,1,2
643.0,540.0,oddlysatisfying,9,Spoon of liquid nitrogen in a bowl of gasoline,1,2
1458.0,660.0,gifs,11,Wholesome moment at the Olympics,1,2
201.0,600.0,RoomPorn,10,Conservatory room addition in the UK [1040x1485],1,2
231.0,600.0,youseeingthisshit,10,There seems to be a problem with my door,1,2
633.0,480.0,nostalgia,8,Modern Warfare 2. Not too long ago but dearly missed.,1,2
360.0,420.0,todayilearned,7,TIL That James Earl Jones “once” used a CB radio to talk to truckers in his Darth Vader voice and used Darth as his handle. He stopped because the truckers “totally freaked out.”,1,2
420.0,360.0,funny,6,"No, wait, watch how awesome I am too.",1,2
257.0,540.0,food,9,[Homemade] Strawberry poptarts,1,2
113.0,360.0,blackpeoplegifs,6,"Get back here, you little shit",1,2
811.0,360.0,space,6,"At $85 million, India's next moon mission is cheaper than production cost of Interstellar",1,2
1547.0,600.0,pics,10,Residents in Idaho put 183 coffins on the steps of the capitol today to protest the state faith-healing exemption that protects parents if they deny their children medical care,1,2
114.0,540.0,aww,9,Looks like my little guy found himself a girlfriend,1,2
87.0,480.0,EmpireDidNothingWrong,8,Rip. Credit: Kylo|Ifunny,1,0
584.0,540.0,Unexpected,9,I can pinpoint the exact moment I started puberty to the first time I saw this scene on Xena: Warrior Princess,1,2
116.0,300.0,funny,5,I made this bad boy out of my old coffee table.,1,2
3116.0,660.0,funny,11,My college doesn't want us to make popcorn in their shitty microwaves,1,2
4471.0,660.0,worldnews,11,"A homophobic video urging Russians to re-elect President Vladimir Putin has gone viral less than a month before the country's election. The video tells voters that if Putin's rivals win they will take Russia into a ""nightmare"" future in which they are forced to co-habitate with gay men.",1,2
2198.0,780.0,pics,13,The Rock's stunt double is also his real-life cousin (Tanoai Reed),1,2
90.0,480.0,StarWars,8,"This is probably the last one of these I’ll do for a little while. (I’ll probably do an imperial series in the future, along with maybe some of the other rebel fighters) I settled on Obi-Wan and Anakin for this one. Enjoy!",1,2
169.0,540.0,corgi,9,after years of being in love and obsessed with corgis... I finally got my very own.,1,2
256.0,720.0,aww,12,Notice Me,1,2
551.0,600.0,trashy,10,This girl's account is a gold mine for stuff like this.,1,2
208.0,600.0,HighQualityGifs,10,"""O Brother Where Art Thou"" is probably my favorite Coen Bros. film. One of my favorite scenes.",1,2
211.0,660.0,aww,11,"Aww yeah, scritches....",1,2
3157.0,720.0,news,12,Tallahassee-area schools to excuse absences for students protesting at state Capitol,1,2
656.0,780.0,funny,13,If I fits...,1,2
973.0,660.0,WhitePeopleTwitte,11,Always hated that 😤,1,2
2113.0,780.0,todayilearned,13,"TIL when the Nazis burned Sigmund Freud's books he said, ""What progress we are making. In the Middle Ages they would have burned me. Now, they are content with burning my books.""",1,2
226.0,540.0,pics,9,Someone on my facebook feed found the portal to the lost socks dimension.,1,2
103.0,420.0,BeAmazed,7,"Inside the largest sinkhole, Xiaozhai Tiankeng, in China",1,2
304.0,600.0,pics,10,Girl loses top on waterslide.,1,2
1490.0,720.0,gaming,12,It’s the truth...,1,2
195.0,600.0,lifehacks,10,Get keys on a keyring with a staple remover,1,2
423.0,780.0,gifs,13,Surfing on train waves,1,2
266.0,780.0,BetterEveryLoop,13,This guy is impressive.,1,2
40.0,360.0,woahdude,6,Opalized wood with visible growth rings,0,2
106.0,720.0,tippytaps,12,Hole In One Taps!!,1,2
1085.0,540.0,PoliticalHumo,9,"When they write three paragraphs of Hillary and Obama theories, but can’t explain why the President appointed a Russian agent as National Security Advisor after being warned by FBI.",1,2
186.0,780.0,PrequelMemes,13,Leaked footage of Ewan McGregor training for the new movie,1,2
414.0,720.0,madlads,12,"Madlad orders insane amount of soda, employee chucks it in the oven!",1,2
1049.0,720.0,dataisbeautiful,12,Total WORDS spoken by each main character of The Office [OC],1,2
109.0,480.0,BlackPeopleTwitte,8,Apple isn't the only corporate jackass in the game,1,2
170.0,720.0,comics,12,Sailing Takes Me Away,1,2
164.0,300.0,photoshopbattles,5,PsBattle: The Rock and his cousin,1,2
129.0,840.0,evilbuildings,14,Greetings from Mordor,1,2
74.0,660.0,aww,11,Friends dog Lyla had SEVEN puppies today. She's very proud.,0,2
1507.0,840.0,television,14,Joel McHale says E! told him to lay off the Kardashians while hosting 'The Soup',1,2
30.0,600.0,Atlanta,10,New bill would allow Georgia adoption agencies deny service to gay couples,0,2
210.0,720.0,dontdeadopeninside,12,"Why did I name my show ""THE JOEL WITH McHALE JOEL SHOW McHALE""?",1,2
77.0,540.0,curlyhai,9,Very good curly hair day,0,2
435.0,540.0,NintendoSwitch,9,The recent DOOM patch added motion controls! Rip and Tear in style!,1,2
40.0,480.0,memes,8,Time heals all wounds,0,2
39.0,780.0,BlackPeopleTwitte,13,Baby come back,0,2
1146.0,840.0,gaming,14,Monster Hunter World - Dual Blade Spine Attack,1,2
46.0,420.0,aww,7,He just wanted to go to the garden party,0,2
145.0,720.0,TheLastAirbende,12,"We all cried during this scene, don't deny it",1,2
88.0,480.0,NatureIsFuckingLit,8,This Hippo is 🔥,1,2
23.0,120.0,combinedgifs,2,Every villain is haunted by the moment that made him the way he is,0,2
198.0,540.0,Jokes,9,A guy with a stutter died in prison,1,2
108.0,600.0,Baking,10,"My friend made these flowers from buttercream, and it's way too gorgeous not to share! She's so talented!",1,2
120.0,480.0,niceguys,8,mmmm'lady *bulge grows signifying confidence*,1,2
112.0,720.0,funny,12,Good for him!,1,2
180.0,480.0,pics,8,A Kenyan lady found her childhood friend on the streets suffering from drug addiction and took him to rehabilitation. (More pics in comments),1,2
806.0,720.0,CasualConversation,12,"I know Fergie probably isn't a Redditor, but just in case she sees this:",1,2
87.0,720.0,crappyoffbrands,12,Does this count?,1,2
61.0,840.0,aww,14,Can I ride shotgun?,0,2
131.0,720.0,Art,12,"Portrait Painting, Digital, 1100x1283",1,2
646.0,540.0,Futurology,9,"Trump Can’t Save Coal: More Capacity Closed Already in 2018 Than in Obama’s Entire First Term - “Beautiful, clean coal” is not seeing a resurgence, despite what the president claims.",1,2
121.0,720.0,mildlyinteresting,12,The close button on my train looks like Kenny,1,2
474.0,900.0,DnD,15,"[ART] My wizard was killed by a crit from Wyverns. The DM let me use one cantrip as they dragged me into the sky, so I cast message on my best friend.",1,2
147.0,540.0,hmmm,9,hmmm,1,2
64.0,720.0,BlackPeopleTwitte,12,The real boss baby,0,2
210.0,720.0,dontdeadopeninside,12,"Why did I name my show ""THE JOEL WITH McHALE JOEL SHOW McHALE""?",1,2
77.0,540.0,curlyhai,9,Very good curly hair day,0,2
435.0,540.0,NintendoSwitch,9,The recent DOOM patch added motion controls! Rip and Tear in style!,1,2
40.0,480.0,memes,8,Time heals all wounds,0,2
39.0,780.0,BlackPeopleTwitte,13,Baby come back,0,2
1146.0,840.0,gaming,14,Monster Hunter World - Dual Blade Spine Attack,1,2
46.0,420.0,aww,7,He just wanted to go to the garden party,0,2
145.0,720.0,TheLastAirbende,12,"We all cried during this scene, don't deny it",1,2
88.0,480.0,NatureIsFuckingLit,8,This Hippo is 🔥,1,2
23.0,120.0,combinedgifs,2,Every villain is haunted by the moment that made him the way he is,0,2
198.0,540.0,Jokes,9,A guy with a stutter died in prison,1,2
108.0,600.0,Baking,10,"My friend made these flowers from buttercream, and it's way too gorgeous not to share! She's so talented!",1,2
120.0,480.0,niceguys,8,mmmm'lady *bulge grows signifying confidence*,1,2
112.0,720.0,funny,12,Good for him!,1,2
180.0,480.0,pics,8,A Kenyan lady found her childhood friend on the streets suffering from drug addiction and took him to rehabilitation. (More pics in comments),1,2
806.0,720.0,CasualConversation,12,"I know Fergie probably isn't a Redditor, but just in case she sees this:",1,2
87.0,720.0,crappyoffbrands,12,Does this count?,1,2
61.0,840.0,aww,14,Can I ride shotgun?,0,2
131.0,720.0,Art,12,"Portrait Painting, Digital, 1100x1283",1,2
646.0,540.0,Futurology,9,"Trump Can’t Save Coal: More Capacity Closed Already in 2018 Than in Obama’s Entire First Term - “Beautiful, clean coal” is not seeing a resurgence, despite what the president claims.",1,2
121.0,720.0,mildlyinteresting,12,The close button on my train looks like Kenny,1,2
474.0,900.0,DnD,15,"[ART] My wizard was killed by a crit from Wyverns. The DM let me use one cantrip as they dragged me into the sky, so I cast message on my best friend.",1,2
147.0,540.0,hmmm,9,hmmm,1,2
64.0,720.0,BlackPeopleTwitte,12,The real boss baby,0,2
197.0,480.0,pics,8,Famed actor Arnold Schwarzenegger posted a photo of himself sleeping on the street under his famous bronze statue.,1,2
104.0,600.0,memes,10,Future time machines,1,2
194.0,420.0,ChoosingBeggars,7,"You have to redo the pic you drew me 6 months ago, because you're a better artist now.",1,2
226.0,840.0,videos,14,Dealing with hecklers like a pro,1,2
40.0,720.0,aww,12,Someone got a little too tuckered from his first hike through the woods,0,2
565.0,900.0,movies,15,"Jordan Peele Shooting Next Film, an Original Genre Movie, Later This Year",1,2
609.0,900.0,MadeMeSmile,15,Hockey skills with a hug,1,2
108.0,720.0,gifsthatkeepongiving,12,Game show created by Darwin,1,2
175.0,780.0,ProgrammerHumo,13,When you're a full-stack developer but still want to credit everyone,1,2
117.0,780.0,aww,13,Proud Father,1,2
294.0,660.0,CryptoCurrency,11,Be careful of exchanges. Would you have noticed this one?,1,2
598.0,900.0,BlackPeopleTwitte,15,Michelle Obama on blackpanther,1,2
95.0,780.0,PenmanshipPorn,13,M I N I M U M,1,2
60.0,480.0,FortNiteBR,8,"The names Bond, James Bond.",0,2
64.0,720.0,OldSchoolCool,12,"""Mister Rogers’ Neighborhood"" started 50 years ago today, 1968",0,2
41.0,960.0,thisismylifenow,16,My parents got a new pup. The old one accepted his new life as a chair,0,2
271.0,840.0,DDLC,14,Late valentine's day gift [LQ],1,2
59.0,780.0,ElderScrolls,13,Talking to a NPC in Oblivion,0,2
191.0,960.0,BlackPeopleTwitte,16,Shame on you Marvel,1,2
201.0,900.0,holdmycosmo,15,HMC while I bring in the pizza,1,2
45.0,900.0,southpark,15,Now We Know Who's Responsible For The Patriot's Losing The Superbowl...,0,2
634.0,900.0,Tinde,15,Her face was covered in every picture,1,2
165.0,540.0,MonsterHunte,9,Dual Blades - Anime OP,1,2
47.0,600.0,outrun,10,New patch came in today.,0,2
3372.0,960.0,videos,16,"The shuttle program cost $57,090 per kg to deliver payload to orbit. SpaceX's upcoming rocket, BFR, will drop that price to $47 per kilogram. We are at the dawn of a new era in terms of what is possible in space.",1,2
181.0,900.0,BlackPeopleTwitte,15,You might’ve been the last one saved from the fire but atleast you were saved,1,2
181.0,900.0,BlackPeopleTwitte,15,You might’ve been the last one saved from the fire but atleast you were saved,1,2
252.0,960.0,nostalgia,16,Your scholastic order will arrive in two weeks,1,2
108.0,660.0,pics,11,Mark Hamill on set wearing Carrie Fisher’s robe.,1,2
431.0,840.0,xboxone,14,Microsoft Crowned One of the Most Ethical Companies in the World,1,2
129.0,660.0,UnethicalLifeProTips,11,"ULPT: If you want one of those multicolored jackets from the 90's but don't like thrift shopping, Mount Everest has a valley full of them.",1,2
326.0,960.0,OSHA,16,"“Move along, nothing to see here”",1,2
209.0,840.0,blunderyears,14,I have been told this was blunder years material. Trying to hide my baldness in 2010.,1,2
32.0,660.0,teenagers,11,This is why im gay,0,2
2380.0,960.0,technology,16,Man sues Microsoft seeking new copy of Windows 7 after forced Windows 10 upgrade,1,2
74.0,720.0,BlackPeopleTwitte,12,The 🕭 does not dismiss you!,0,2
121.0,480.0,movies,8,Today is the 25th Anniversary of the Release of 'Army Of Darkness'.,1,2
2573.0,960.0,pics,16,Trying to teach I.T in a Ghanaian village.,1,2
111.0,780.0,theydidthemath,13,[Request] What would the dimensions of the earth be if cars were like this?,1,2
29.0,540.0,whitepeoplegifs,9,Olympics coverage,0,2
132.0,960.0,perfectloops,16,Got all 8! [A],1,2
84.0,780.0,PrequelMemes,13,Fixed those posters for you all.,1,2
64.0,960.0,AnimalsBeingDerps,16,Thhhrrlllpp,0,2
52.0,600.0,BlackPeopleTwitte,10,Don’t forget to slap 👋,0,2
164.0,720.0,aww,12,"Baby black panther goes swimming for the first time, instantly realises she's made a huge mistake",1,2
1718.0,900.0,Showerthoughts,15,One day Rick Astley will die and no one will click on the headline.,1,2
97.0,480.0,gifs,8,One man and his wetsuit..,1,2
33.0,960.0,Atlanta,16,Cobb woman who faked being cop for Chick-Fil-A discount indicted,0,2
240.0,900.0,BlackPeopleTwitte,15,Seems like we all lose in this situation.,1,2
246.0,1020.0,Damnthatsinteresting,17,James Randi is a leader in the skeptical community who has been debunking paranormal and supernatural claims for most of his life.,1,2
52.0,480.0,aww,8,Is he to big for aww?,0,2
88.0,1080.0,savedyouaclick,18,"How you can play new PS4 game God of War early... but there’s a catch | And that is you can’t. It’s not the new God of War, it’s not even a PS4 game. It’s just a GOW text based game on Facebook messenger.",1,1
341.0,1080.0,holdmybee,18,HMB while I plank on top of a door,1,2
1415.0,1020.0,iamverysmart,17,I want to delete his account.,1,2
133.0,660.0,bee,11,Merlin Milk Stout puts on a show.,1,2
74.0,120.0,europe,2,[Idea] What about having our own Eurovision on Reddit ?,0,2
64.0,720.0,BlackPeopleTwitte,12,The real boss baby,0,2
103.0,780.0,Conservative,13,'The Daily Wire' Will No Longer Publish Names Or Pictures Of Mass Shooters,1,2
3116.0,660.0,funny,11,My college doesn't want us to make popcorn in their shitty microwaves,1,2
46.0,480.0,Seattle,8,"Washington state really is breathtaking. This was an impromptu shot today, driving home from Chelan.",0,2
39.0,540.0,OnePiece,9,Found this and it made me laugh.,0,2
70.0,1020.0,CatTaps,17,My derpy cat tapping at the camera,0,1
1146.0,840.0,gaming,14,Monster Hunter World - Dual Blade Spine Attack,1,2
898.0,1080.0,eactiongifs,18,MRW when I'm at the African American History Museum and I complain that the lower level is too tight and cramped but someone explains it symbolizes being packed in a ship during the early slave trade,1,2
65.0,660.0,freefolk,11,Jon leaving Winterfell for the first time and Jon retaking Winterfell,0,2
24.0,300.0,NatureIsFuckingLit,5,I want to be🔥 like my fellow cat over here,0,1
148.0,1020.0,surrealmemes,17,ⒺⒹⒾⓉ,1,2
36.0,600.0,drawing,10,An older drawing. Still the most realistic portrait I've ever done,0,2
765.0,1080.0,instant_regret,18,Bathing cats,1,1
45.0,900.0,gamegrumps,15,I swear Audrey roasts her Dad daily.,0,2
559.0,780.0,thewalkingdead,13,The Walking Dead is no longer in top 250 on IMDB,1,2
9.0,540.0,PuppySmiles,9,Such a handsome smile,0,2
661.0,780.0,baseball,13,[Gomez] It’s done. JD Martínez is a Red Sox.,1,2
350.0,840.0,math,14,This was on an abstract algebra midterm. Maybe I don’t deserve a math degree.,1,2
89.0,840.0,comicbooks,14,Mignola's Hellboy is pure gold in every aspect. [Hellboy - The Island #1],1,2
48.0,300.0,MMA,5,"Yo r/mma! I’m headed out right now to climb Mount Kilimanjaro, the highest freestanding mountain in the world! With newly crowned Super Bowl Champ Chris Long! Here is why we are doing it!",0,2
1.0,720.0,Eyebleach,12,Pure Happiness,0,2
8.0,360.0,Xenoblade_Chronicles,6,Brighid is elegant! ELEGANT!,0,2
10.0,1020.0,MemeEconomy,17,my first investment,0,2
20.0,1080.0,battlestations,18,"Found a picture of my first battlestation, this is where it all started",0,2
6.0,1260.0,MadeMeSmile,21,"I was having a bad day and this woman dropped off flowers. The real tear jerker is that her son killed himself 2 years ago. She hugged me and said, ""maybe if he had met some one like you, he would still be alive.""",0,2
13.0,360.0,btc,6,Why Tether’s latest statement about its auditor is complete BS,0,2
17.0,360.0,Cricket,6,"""His ability to make you look like an absolute fool"" - KP",0,2
16.0,1140.0,tumbl,19,It is time to tell this story,0,2
106.0,1020.0,baseball,17,"[TJC&SP] Greg Bird: ""I don't like sand...it gets everywhere""",1,2
14.0,540.0,olympics,9,Drunk Korean Spectator Scored 53.0 After Falling Into The Pipe,0,2
25.0,960.0,movies,16,Free Presidents' Day Screenings of 'Get Out' at AMC theaters,0,2
62.0,1080.0,CasualUK,18,Waitrose really has their ear to the ground,0,2
3.0,480.0,justneckbeardthings,8,"Australia's own elected neckbeard, George Christensen",0,2
106.0,780.0,upaulsdragrace,13,The Daenerys Targaryen of Drag,1,2
19.0,420.0,offlineTV,7,How did Albert make it back to LA before everyone. :thinking:,0,2
14.0,900.0,DunderMifflin,15,I think we all know who Fergie was channelling during her National Anthem,0,2
37.0,420.0,EscapefromTarkov,7,BSG: Why the Mosin Nagant will take Tarkov to a whole new level!,0,2
18.0,660.0,television,11,Batman: The Animated Series Show Bible,0,2
21.0,600.0,Showerthoughts,10,The loudest way to open a bag of chips is to attempt to open them quietly,0,2
5.0,1380.0,blop,23,Crashed out blop,0,2
8.0,1200.0,disneyvacation,20,How to assassinate your ex,0,2
30.0,780.0,OldSchoolCool,13,"An unidentified couple in a bar in Seattle, 1944.",0,2
6.0,720.0,drawing,12,neon lights and augmentations,0,2
22.0,120.0,nanocurrency,2,Please Read! Get ready for the next weeks!! (Nano Mooning),0,2
20.0,1200.0,NLSSCircleJerk,20,It's actually time to stop,0,2
70.0,1020.0,CatTaps,17,My derpy cat tapping at the camera,0,1
60.0,960.0,BigCatGifs,16,Cheetah gets chin scratchies.,0,2
95.0,960.0,VaporwaveAesthetics,16,Ｃｈｏｏｓｅ Ｙｏｕｒ Ｆｌａｖｏｕｒ,1,2
792.0,900.0,gadgets,15,Sony releases mysterious teaser for its next phone.,1,2
54.0,780.0,wheredidthesodago,13,Helen forgot to glue the phone to her face while ironing her spray-painted shirts,0,2
61.0,420.0,FireEmblemHeroes,7,I drew Roy as a kitten,0,2
277.0,1020.0,holdmyredbull,17,Hold My Redbull while I fly to the beach,1,2
45.0,960.0,Pareidolia,16,This Breakdancing Log,0,2
59.0,480.0,youtubehaiku,8,[Poetry]It's a fucking emu,0,2
48.0,600.0,CatastrophicFailure,10,Train Crash in Attica NY today. No injuries.,0,2
3.0,420.0,Atlanta,7,Atlanta Police search for missing CDC employee - Story,0,2
344.0,1020.0,nonononoyes,17,Cat-like reflexes,1,1
11.0,900.0,Atlanta,15,The view of our beloved MARTA you’ve never seen before,0,2
94.0,720.0,OldSchoolCool,12,My parents at their wedding-1993,1,2
103.0,780.0,Conservative,13,'The Daily Wire' Will No Longer Publish Names Or Pictures Of Mass Shooters,1,2
325.0,720.0,facepalm,12,They give their child 100.00 $ to spend unsupervised and then punish him for what he spent it on. A+ parenting there.,1,2
54.0,480.0,nostalgia,8,Xbox 360 Gamer Pictures,0,2
124.0,1020.0,wholesomebpt,17,Less thoughts and prayers and more actions,1,2
177.0,540.0,CombatFootage,9,[Afghanistan] US Machine gun nest gets caught in a crossfire,1,2
25.0,540.0,BlackPeopleTwitte,9,🤟,0,2
61.0,960.0,gifs,16,"Mittens, you're a bad influence on him.",0,2
253.0,1020.0,funny,17,How to help the cat out of the well...,1,1
24.0,300.0,NatureIsFuckingLit,5,I want to be🔥 like my fellow cat over here,0,1
800.0,1020.0,funny,17,My wife just texted me this picture of our cat playing behind the TV,1,1
126.0,1080.0,aww,18,Little good boy practicing his best guard dog face.,1,2
148.0,1020.0,surrealmemes,17,ⒺⒹⒾⓉ,1,2
852.0,1140.0,Eyebleach,19,Rescued beaver gathering tools to build his dam,1,2
2038.0,1020.0,explainlikeimfive,17,"ELI5: How do movies get that distinctly ""movie"" look from the cameras?",1,2
59.0,540.0,CollegeBasketball,9,Nice,0,2
473.0,1080.0,softwaregore,18,I don’t really know what to say.,1,2
7.0,480.0,aww,8,Met a Wise Old Fren today,0,2
43.0,420.0,dogpictures,7,"Thunder, my family's dog is being put down tomorrow. I'm in college across the country and just got the call. I'm really gonna miss this face.",0,2
512.0,1140.0,woahdude,19,"No editing, just makeup",1,2
416.0,1200.0,BikiniBottomTwitte,20,Krabby O Mondays,1,2
136.0,1140.0,AnimalsBeingBros,19,Dog and kitten,1,2
10.0,720.0,Atlanta,12,Distorted Mural Near Ponce,0,2
872.0,1140.0,HumansBeingBros,19,Ryan Reynolds meeting with children from the Make-a-wish and Childrens Wish Foundations on the set of 'Deadpool 2'.,1,2
341.0,1080.0,holdmybee,18,HMB while I plank on top of a door,1,2
177.0,1020.0,wholesomegifs,17,Boy walking for the first time after a life-changing surgery,1,2
484.0,1020.0,videos,17,me watching Kingdom Hearts III trailers,1,2
11.0,420.0,curledfeetsies,7,Fell asleep in the car today,0,2
811.0,1260.0,BlackPeopleTwitte,21,What not to watch,1,2
531.0,1140.0,pics,19,Entrance to a shrine in Japan,1,2
1415.0,1020.0,iamverysmart,17,I want to delete his account.,1,2
74.0,1140.0,pics,19,Pretty good marketing,0,2
33.0,720.0,BlackPeopleTwitte,12,All dogs go to heaven,0,2
103.0,660.0,MapPorn,11,Exaggerated Relief Map of the Indian Subcontinent [1080x1068],1,2
28.0,420.0,lego,7,"So, here's a special set. My nephew died at the age of 13 in 2008 from lymphoma. I used to hang out with him in the ICU during his chemo and transplant stays and we'd build Lego together. This one was unfinished, and it wasn't exactly on an anniversary, but it felt like it was time to finish it.",0,2
765.0,1080.0,instant_regret,18,Bathing cats,1,1
88.0,1080.0,savedyouaclick,18,"How you can play new PS4 game God of War early... but there’s a catch | And that is you can’t. It’s not the new God of War, it’s not even a PS4 game. It’s just a GOW text based game on Facebook messenger.",1,1
765.0,1080.0,instant_regret,18,Bathing cats,1,1
88.0,1080.0,savedyouaclick,18,"How you can play new PS4 game God of War early... but there’s a catch | And that is you can’t. It’s not the new God of War, it’s not even a PS4 game. It’s just a GOW text based game on Facebook messenger.",1,1
21.0,720.0,AccidentalWesAnderson,12,3:11:36,0,2
458.0,1080.0,gaming,18,I think the plants are watching me [Kingdom Come: Deliverance},1,2
44.0,900.0,aww,15,"Even at work, I can't potty without supervision",0,2
129.0,1020.0,nononono,17,A Hawk reminds the drone that he is king.,1,2
45.0,900.0,gamegrumps,15,I swear Audrey roasts her Dad daily.,0,2
301.0,1020.0,Jokes,17,If pronouncing my b's as v's makes me sound Russian...,1,2
26.0,720.0,BlackPeopleTwitte,12,"Try outs are official open, best shoot your shot",0,2
2255.0,1140.0,gifs,19,A few hours from the summit of Mt. Everest.,1,2
9.0,420.0,astrophotography,7,Full Moon from Texas,0,2
898.0,1080.0,eactiongifs,18,MRW when I'm at the African American History Museum and I complain that the lower level is too tight and cramped but someone explains it symbolizes being packed in a ship during the early slave trade,1,2
113.0,840.0,pics,14,A cloud bursts over Phoenix .,1,2
34.0,480.0,hmmm,8,hmmm,0,2
5.0,600.0,AtlantaHawks,10,Tiago Splitter retirement thread upvote party,0,2
128.0,540.0,trashy,9,I have a bowl especially for ramen,1,2
98.0,1080.0,holdmyjuicebox,18,HMJB while I eat this cookie,1,2
49.0,1020.0,aww,17,Bedtime Buddies,0,2
17.0,660.0,MemeEconomy,11,"Short Drake, Long Elon",0,2
40.0,720.0,ATBGE,12,Mario Haircut,0,2
139.0,1140.0,PeopleFuckingDying,19,GoOd BoYe CoVeRdEd In BaLlS sErVEd FoR dINnEr.,1,2
258.0,1080.0,funny,18,For a good LEGO imagination,1,2
79.0,120.0,gifs,2,Seth Rogan using witchcraft,1,2
28.0,420.0,lego,7,"So, here's a special set. My nephew died at the age of 13 in 2008 from lymphoma. I used to hang out with him in the ICU during his chemo and transplant stays and we'd build Lego together. This one was unfinished, and it wasn't exactly on an anniversary, but it felt like it was time to finish it.",0,2
84.0,1080.0,NotMyJob,18,Ad's ready for print boss,1,2
57.0,780.0,nostalgia,13,The old YouTube app icon.,0,2
417.0,1140.0,gaming,19,Gotta love steam reviews,1,2
101.0,1200.0,BeforeNAfterAdoption,20,Meet Waldo. From crusty and underweight to a very fluffy boy.,1,2
533.0,1080.0,TwoXChromosomes,18,First revenge porn case won in UK!,1,2
20.0,1200.0,Atlanta,20,I took a flight around the city and got a cool view of the Downtown skyline,0,2
163.0,780.0,todayilearned,13,"TIL during filming of Gangs of New York, they built what was essentially a full scale complete replica of the Five Points in 1800's New York. According to the DVD commentary, George Lucas visited the set and explained that CGI effects would be much cheaper but Scorsese insisted on authenticity.",1,2
235.0,780.0,creepy,13,Something is in the Basement,1,2
18.0,540.0,BlackPeopleTwitte,9,"""I would've seen Black Panther a third time if I could""",0,2
2201.0,1200.0,starterpacks,20,Annoyingly wholesome couple Starterpack,1,2
150.0,600.0,socialism,10,"""FOOD IS NOT A WEAPON FOR PUNISHING AMERICANS IN NEED""",1,2
335.0,480.0,mildlyinfuriating,8,"These ""Suggestive Tip"" amounts",1,2
14.0,360.0,aww,6,"Reshi was chained up at a construction site in Qatar, now he's living the good life after being rescued.",0,2
1135.0,1020.0,pics,17,Israeli Army Girl,1,2
44.0,660.0,FortNiteBR,11,Walking to the Battle Bus in Season 3,0,2
30.0,360.0,forhono,6,Miserum intensifies,0,2
27.0,660.0,FortNiteBR,11,When your squad gets hit and needs to heal up,0,2
34.0,1080.0,funny,18,Went to go do laundry this morning and found this gem!,0,2
598.0,1140.0,educationalgifs,19,How Common Dental Procedures are done! [Pt. 1],1,2
1645.0,1140.0,gaming,19,Something stupid happened,1,2
846.0,1200.0,DIY,20,I built some high-end speakers,1,2
25.0,900.0,futurama,15,It’s an Albino Humping Worm!,0,2
17.0,420.0,anime_irl,7,anime irl,0,2
116.0,1080.0,gifs,18,Two Types of Friends,1,2
