comments,minutes,subreddit,time,title,yes_no,new_variable
49.0,540.0,gifs,9,Just a perfect landing,0,2
1217.0,660.0,CringeAnarchy,11,Eating the rich.,1,2
10.0,240.0,aww,4,"My girlfriend told me to take a picture of MY black puppy, after she saw the other black puppy get all the, ""ups"".",0,2
44.0,300.0,startrek,5,Picard totally knows how to handle Worf,0,2
35.0,240.0,todayilearned,4,TIL that hundreds of hip-hop songs can be traced back to Slick Rick's and Doug E. Fresh's La Di Da Di (1985),0,2
49.0,420.0,ComedyCemetery,7,Who else but Dobson?,0,2
10.0,300.0,2meirl4meirl,5,2meirl4meirl,0,2
116.0,720.0,KendrickLama,12,"Here's Kendrick at my friends Grandma's, British working class household. They had Shepherd's Pie for dinner.",1,2
150.0,480.0,technology,8,D.C. has given Elon Musk a permit to do a little digging for the Hyperloop,1,2
12.0,120.0,gatekeeping,2,Seriously though [satire],0,2
97.0,360.0,MapPorn,6,"Over which countries can Chile go inside, with room to drive around it? [5616x2392][OC]",1,2
7.0,480.0,smoobypost,8,Savage smoob,0,2
28.0,660.0,tumbl,11,video games,0,2
307.0,900.0,ColorizedHistory,15,"The Capture of William Joyce, aka ""Lord Haw Haw"" - Anglo-Irish Fascist politician and Nazi propaganda broadcaster in Germany, May 1945.",1,2
32.0,360.0,pics,6,"After my lamps made the front page of reddit two weeks ago, I got a bunch of orders. Here is the latest batch!",0,2
58.0,480.0,holdmycosmo,8,HMC while I stand on a glass table,0,2
3.0,2760.0,CozyPlaces,46,State of coziness,0,2
144.0,300.0,MMA,5,The main event face-off: @yancymedeiros came baring gifts for @cowboycerrone #UFCAustin,1,2
31.0,360.0,sjwhate,6,Racism,0,2
13.0,360.0,pics,6,Waking up to the one you love,0,2
77.0,360.0,motorcycles,6,DiWHY,0,2
55.0,960.0,PandR,16,When someone says I am depressed.,0,2
11.0,120.0,memes,2,Teachers Be Like,0,2
16.0,300.0,firstworldanarchists,5,Don’t tell me what I can and can’t point at,0,2
61.0,660.0,gaming,11,"Look at me, I'm the Crabtain now",0,2
75.0,420.0,CrappyDesign,7,I absolutely hate paper towel packaging!!! Just tell me the actual number of rolls dammit,0,2
27.0,420.0,Showerthoughts,7,"""He died doing what he loved"" would be a really awkward thing to say at a drug addict's funeral.",0,2
696.0,1020.0,gatekeeping,17,Anti-gatekeeping on /r/military,1,2
31.0,480.0,ArcherFX,8,You’re authority is not recognized in Fort Kickass!,0,2
61.0,360.0,mildlyinteresting,6,My new car has a tiny Loch Ness Monster on the back window,0,2
14.0,300.0,trashpandas,5,Baby raccoon does not want to go home,0,2
19.0,420.0,environment,7,Obama tried to close a big pollution loophole. Trump wants to keep it.,0,2
87.0,420.0,mildlyinfuriating,7,Neflix’s rating system,1,2
58.0,720.0,Badfaketexts,12,POKEMON,0,2
163.0,840.0,KerbalSpaceProgram,14,"It has taken a couple weeks, but I got it!",1,2
158.0,480.0,legaladvice,8,School using cell service jammer(s)?,1,2
86.0,240.0,MonsterHunte,4,(˵ ͡° ͜ʖ ͡°˵),1,2
61.0,540.0,iiiiiiitttttttttttt,9,You just can't help some people...,0,2
116.0,240.0,Conservative,4,Ben Shapiro roasts woman about abortion...,1,2
124.0,420.0,apple,7,I wish Apple Maps notified me of an upcoming directional change about 100 feet earlier,1,2
84.0,180.0,spacex,3,"Team at Vandenberg is taking additional time to perform final checkouts of upgraded fairing. Payload and vehicle remain healthy. Due to mission requirements, now targeting February 21 launch of PAZ",1,2
14.0,360.0,DunderMifflin,6,Michael Scott admitting his flaws.,0,2
103.0,1020.0,happy,17,"My Grandma and me. She was born in 1910, and I grew up visiting her in her tarpaper, tin roof home, using an outhouse with two seats. She never complained or judged others. She was the best kind of person.",1,2
64.0,540.0,vexillology,9,Flag of Wakanda (from 'Black Panther'),0,2
125.0,840.0,Simulated,14,Bear skin and fur simulation,1,2
19.0,540.0,Blep,9,We adopted Bob after he had some teeth pulled. It's been nothing but bleps since!,0,2
63.0,240.0,insanepeoplefacebook,4,Local news stations provide the best Facebook insanity fuel,0,2
104.0,180.0,jobs,3,"I'm an ex-recruiter for some of the top companies in the world. I've screened tens of thousands of resumes, and today I published my preferred resume format, free to download as a Word doc, along with some general resume advice.",1,2
651.0,600.0,pics,10,My wife made this awesome cake for my birthday today!,1,2
31.0,360.0,sjwhate,6,Racism,0,2
26.0,480.0,TheSimpsons,8,"Good afternoon, How do you do, sir? Hahaha Sucker...",0,2
109.0,660.0,DeepFriedMemes,11,Smash like to spell ℹ️☪️♈️🅿️ 🅿️ro🅿️perly😭😂😂💯💯,1,2
7.0,2340.0,evilbuildings,39,It's Always Evil in Philadelphia,0,2
44.0,240.0,sadcringe,4,Sad because nice guy finishes last again 😓,0,2
42.0,300.0,RoomPorn,5,"Lobby for Hotel Danieli, Venice Italy. [1709x2100]",0,2
54.0,240.0,eddevils,4,When a 3yo draws the lines on MS Paint,0,2
44.0,360.0,PoliticalHumo,6,Yeah that sounds about right.,0,2
120.0,480.0,lewronggeneration,8,"Because as we know, it is impossible for millennials to do these things.",1,2
121.0,840.0,nononono,14,Just step this way,1,2
18.0,360.0,aww,6,My dog the day I got him vs 1 year later. He’s about 40 pounds of energy :),0,2
84.0,300.0,keto,5,[Pics] I have a little black dress!!,1,2
116.0,240.0,Conservative,4,Ben Shapiro roasts woman about abortion...,1,2
186.0,480.0,vegan,8,No! Bad cat!,1,1
414.0,780.0,tifu,13,TIFU by playing on my PC with a PS4 Controller,1,2
136.0,900.0,blackmagicfuckery,15,Floorboard waves,1,2
58.0,780.0,surrealmemes,13,Grass,0,2
58.0,1020.0,comics,17,Abracadabra!,0,2
37.0,540.0,coaxedintoasnafu,9,phines an forb,0,2
9.0,300.0,Unexpected,5,the perfect photo (from r/gaming),0,2
88.0,420.0,The_Muelle,7,The Cult with no Personality.,1,2
2.0,360.0,BlackPeopleTwitte,6,"""Don't get excited, just here to grab a water bottle""",0,2
33.0,360.0,4PanelCringe,6,Oof,0,2
5.0,300.0,Atlanta,5,Free chicken biscuits at Fernbank Science Center.,0,2
292.0,600.0,FortNiteBR,10,"Epic, you don't need to change stuff for the sake of it.",1,2
41.0,480.0,pics,8,Sperm Whales sleep vertically!,0,2
112.0,540.0,MechanicalKeyboards,9,My Little Fella,1,2
89.0,840.0,tippytaps,14,Clever tippy taps to trick worms into thinking it’s raining 🌧,1,2
56.0,300.0,antiMLM,5,"Apologies if this is not allowed! I see a lot of really terrible LLR ""pattern mixing"" and just wanted to show a good example of what it's supposed to look like. Notice how it looks like a deliberate, cohesive outfit?",0,2
9.0,180.0,disneyvacation,3,How to Know Which Pot Plants to Discriminate Against,0,2
0.0,180.0,tuckedinkitties,3,This is his sleepy glare when I turn the light on,0,2
81.0,420.0,WeWantPlates,7,"Crackers with fried ham and dressing, served on a bone resting on barley grain in a bowl.",1,2
29.0,480.0,Jokes,8,"Several of Hitlers Generals disappeared after the war, and became animal doctors.",0,2
15.0,180.0,powerwashingporn,3,3 hours work in 15 seconds,0,2
56.0,360.0,AskHistorians,6,How do cities die?,0,2
50.0,300.0,FireEmblemHeroes,5,Roy was later found dead,0,2
23.0,180.0,toosoon,3,Still too soon?,0,2
41.0,420.0,PropagandaPosters,7,"""This guy has an honest, open face"", USSR, 1960's",0,2
8.0,180.0,food,3,[Homemade] Banana bread pudding & vanilla ice cream,0,2
2.0,240.0,curledfeetsies,4,B having a little nap,0,2
82.0,600.0,liberalgunowners,10,First saw this meme a year ago,1,2
696.0,1020.0,gatekeeping,17,Anti-gatekeeping on /r/military,1,2
83.0,720.0,gaming,12,"More mobile games should have this feature, as insulting as it may seem",1,2
28.0,420.0,greentext,7,Anon enjoys school,0,2
40.0,240.0,mildlyinteresting,4,This fallen tree with pennies stuck in it...,0,2
6.0,480.0,AtlantaHawks,8,Should the Hawks draft Quavo?,0,2
13.0,300.0,aww,5,20 years of waiting...my first dog of my own,0,2
4.0,120.0,memes,2,LGTV Pride yo,0,2
22.0,240.0,travel,4,"Still dreaming of my semester abroad • Venice, Italy",0,2
48.0,600.0,Showerthoughts,10,Google missed an opportunity to start Google Space by placing a rotating camera on top of Elon's car.,0,2
17.0,540.0,EarthPorn,9,"Waterfalls at Plitvice Lakes, Croatia 1280x720 [OC]",0,2
19.0,240.0,wtfstockphotos,4,Oh yeah that's goood,0,2
19.0,420.0,environment,7,Obama tried to close a big pollution loophole. Trump wants to keep it.,0,2
88.0,420.0,The_Muelle,7,The Cult with no Personality.,1,2
2.0,360.0,BlackPeopleTwitte,6,"""Don't get excited, just here to grab a water bottle""",0,2
33.0,360.0,4PanelCringe,6,Oof,0,2
5.0,300.0,Atlanta,5,Free chicken biscuits at Fernbank Science Center.,0,2
292.0,600.0,FortNiteBR,10,"Epic, you don't need to change stuff for the sake of it.",1,2
41.0,480.0,pics,8,Sperm Whales sleep vertically!,0,2
112.0,540.0,MechanicalKeyboards,9,My Little Fella,1,2
89.0,840.0,tippytaps,14,Clever tippy taps to trick worms into thinking it’s raining 🌧,1,2
56.0,300.0,antiMLM,5,"Apologies if this is not allowed! I see a lot of really terrible LLR ""pattern mixing"" and just wanted to show a good example of what it's supposed to look like. Notice how it looks like a deliberate, cohesive outfit?",0,2
9.0,180.0,disneyvacation,3,How to Know Which Pot Plants to Discriminate Against,0,2
0.0,180.0,tuckedinkitties,3,This is his sleepy glare when I turn the light on,0,2
81.0,420.0,WeWantPlates,7,"Crackers with fried ham and dressing, served on a bone resting on barley grain in a bowl.",1,2
29.0,480.0,Jokes,8,"Several of Hitlers Generals disappeared after the war, and became animal doctors.",0,2
15.0,180.0,powerwashingporn,3,3 hours work in 15 seconds,0,2
56.0,360.0,AskHistorians,6,How do cities die?,0,2
50.0,300.0,FireEmblemHeroes,5,Roy was later found dead,0,2
23.0,180.0,toosoon,3,Still too soon?,0,2
41.0,420.0,PropagandaPosters,7,"""This guy has an honest, open face"", USSR, 1960's",0,2
8.0,180.0,food,3,[Homemade] Banana bread pudding & vanilla ice cream,0,2
2.0,240.0,curledfeetsies,4,B having a little nap,0,2
82.0,600.0,liberalgunowners,10,First saw this meme a year ago,1,2
696.0,1020.0,gatekeeping,17,Anti-gatekeeping on /r/military,1,2
83.0,720.0,gaming,12,"More mobile games should have this feature, as insulting as it may seem",1,2
28.0,420.0,greentext,7,Anon enjoys school,0,2
40.0,240.0,mildlyinteresting,4,This fallen tree with pennies stuck in it...,0,2
51.0,420.0,FortNiteBR,7,This sort of structure in Wailing Woods could be pretty cool,0,2
76.0,420.0,CampingandHiking,7,Been looking forward to this,0,2
900.0,1020.0,aww,17,What my cat does behind my back in order to get my attention 😂,1,1
157.0,600.0,iamverybadass,10,I thought this might fit here,1,2
31.0,300.0,MMA,5,Outstanding flying armbar from 2009. The opponent doesn't believe it and the ref can't help but smile,0,2
38.0,120.0,worldnews,2,Facebook VP says Russian meddling aimed to divide America and it's working 'incredibly well',0,2
34.0,420.0,FortNiteBR,7,When a heart breaks it don't break even,0,2
29.0,180.0,PoliticalHumo,3,Christians are bulletproof?,0,2
42.0,480.0,DeepFriedMemes,8,Wow😳this is deep,0,2
18.0,240.0,FortNiteBR,4,Was in the car when something caught my eye.,0,2
65.0,360.0,NintendoSwitch,6,Walmart Canada gave me a free copy of Rocket League when I bought my Nintendo Switch yesterday.,0,2
65.0,480.0,Bitcoin,8,Visa confirms Coinbase wasn’t at fault for overcharging users,0,2
85.0,480.0,gaming,8,All for the Love of Sleve McDichael,1,2
15.0,240.0,trebuchetmemes,4,What is this heresy!?,0,2
8.0,420.0,misleadingthumbnails,7,Piles of Magic The Gathering cards,0,2
5.0,180.0,aww,3,My 7-year-old Great Dane reluctantly sharing her favorite spot with the new puppy,0,2
16.0,180.0,disney,3,I doubt anyone here feels the same way but this has always been my all time favorite ride in Disney World. Got this awesome retro style print of it the other day and couldn't be happier.,0,2
30.0,300.0,PoliticalHumo,5,Hmmm,0,2
16.0,2880.0,todayilearned,48,"TIL that when a man had a heart attack at a grocery story in rural Minnesota, 20 people lined up and performed CPR on him for over an hour and a half until paramedics arrived - and he survived",0,2
68.0,600.0,shittyfoodporn,10,Pie,0,2
24.0,360.0,FrankOcean,6,"3 students dyed their hair blonde to honor and remember their classmate, Joaquin Oliver, who was killed in the Florida school massacre",0,2
30.0,240.0,upaulsdragrace,4,"Happy 35th Birthday to Ms Courtney Act, the oldest living twink and our current reigning CBB winner",0,2
191.0,480.0,Futurology,8,Mitt Romney: 90% Of Americans Will Be Buying Electric Cars In 10 Years,1,2
163.0,840.0,KerbalSpaceProgram,14,"It has taken a couple weeks, but I got it!",1,2
46.0,540.0,Showerthoughts,9,“Finally” is pronounced as ‘Final - e’ but “finale” is pronounced as 'fi - nally’.,0,2
46.0,540.0,Showerthoughts,9,“Finally” is pronounced as ‘Final - e’ but “finale” is pronounced as 'fi - nally’.,0,2
87.0,360.0,insanepeoplefacebook,6,Apparently no one should ever try to fix problems and we should stop complaining about mass shootings,1,2
6.0,420.0,AtlantaUnited,7,Tifo idea for the DC United game: Maui from Moana with the caption “What can I say but you’re welcome!”,0,2
8.0,360.0,arepuppers,6,doing a hekkin determine,0,2
36.0,300.0,FortNiteBR,5,"Last night I swore I saw something pop up on my screen. After rewatching the clip, this is what I found",0,2
3.0,420.0,2meirl4meirl,7,2meirl4meirl,0,2
25.0,840.0,funny,14,There are two kinds of children,0,2
103.0,1020.0,happy,17,"My Grandma and me. She was born in 1910, and I grew up visiting her in her tarpaper, tin roof home, using an outhouse with two seats. She never complained or judged others. She was the best kind of person.",1,2
10.0,360.0,AtlantaHawks,6,Actually starting to get really hype about Collins,0,2
20.0,360.0,urbanexploration,6,"Abandoned house in Bostwick, GA",0,2
23.0,180.0,offlineTV,3,WHEN KIMI POURS MILK BEFORE CEREAL,0,2
120.0,240.0,neoliberal,4,"""Romney said he agrees with President Donald Trump on the need for border security, including penalties for employers who hire illegal immigrants and stopping chain migration, a term critics use to describe family-based immigration.""",1,2
47.0,60.0,movies,1,'The Secret Life of Walter Mitty' (2013) is a severely overlooked movie,0,2
55.0,600.0,engrish,10,The blade on my RC helicopter,0,2
136.0,660.0,sweden,11,Cyberpunk Pressbyrån,1,2
19.0,120.0,pics,2,Waffles for breakfast in Belgium,0,2
159.0,300.0,news,5,"Missouri High School Student Found With Gun and Ammunition, Intentions Unknown",1,2
5260.0,1020.0,AskReddit,17,What is the dumbest activity you are enjoying regardless what people think about it?,1,2
9.0,360.0,SnapLenses,6,Did I interrupt something?,0,2
91.0,300.0,oculus,5,The VR game we REALLY need.,1,2
3.0,180.0,aww,3,Dog support,0,2
29.0,120.0,FortNiteBR,2,Multiple people reviving one person should make the revive timer shorter,0,2
7.0,120.0,aww,2,"Hey Reddit, meet Charlie!",0,2
13.0,480.0,aww,8,Our new overnight supurrvisor has decided to stay and observe me this morning,0,2
9.0,360.0,hmmm,6,hmmm,0,2
148.0,180.0,BlackPeopleTwitte,3,Not a care in the world,1,2
223.0,120.0,movies,2,New Image from Netflix's Post-Apocalyptic Zombie-Thriller 'Cargo' - Starring Martin Freeman & Anthony Hayes,1,2
1056.0,240.0,todayilearned,4,"TIL in 1976, a mule named Lord Fauntleroy beat 200 horses in the 3,500-mile Great American Horse Race. Along the way, Norton, the mule’s rider, would often stop to help other riders, beat everyone by 10 hours, and retired with the $25,000 prize while calling himself the “Great American Horseman.”",1,2
747.0,180.0,instant_regret,3,"Wait, I changed my mind",1,2
322.0,240.0,Art,4,"Dragon bones by Stefan Koidl, digital, 2018.",1,2
266.0,180.0,AnimalsBeingBros,3,Pony lets corgi hop on his back.,1,2
172.0,120.0,GifRecipes,2,Pigs in a Blanket Baked Brie [OC],1,2
210.0,300.0,MovieDetails,5,"In The Incredibles, in Bob Parr's home office, there's a photo from a fishing trip where it appears he caught Bruce from Finding Nemo.",1,2
287.0,300.0,pics,5,My wife made this awesome cake for my birthday today!,1,2
476.0,240.0,space,4,Apollo astronaut lost his wedding ring during his trip to the moon... and found it again during a spacewalk.,1,2
136.0,180.0,wholesomegifs,3,Dad uses brilliant technique to allow his blind son to enjoy Football Match,1,2
71.0,240.0,wholesomebpt,4,Along came a kind stranger,0,2
129.0,300.0,gaming,5,ryu can close your door easily,1,2
113.0,180.0,oddlysatisfying,3,Perfect calligraphy,1,2
387.0,240.0,Showerthoughts,4,Somebody who thinks that feathers on dinosaurs would suddenly make them not-scary has never been chased by a goose.,1,2
268.0,240.0,BeAmazed,4,Chongqing residents of this apartment building don't have far to go to the train station! Noise reduction gears make it only as noisy as a dishwasher.,1,2
805.0,180.0,RussiaLago,3,"There have been 241 posts in /r/The_Donald linking directly to the twitter account @TEN_GOP, which we know from yesterday's indictment was a fake account controlled by Russian operatives.",1,2
76.0,120.0,MadeMeSmile,2,Dad helping his blind son to enjoy a football match,0,2
459.0,300.0,StoppedWorking,5,Cat.exe crashed,1,1
115.0,240.0,babyelephantgifs,4,That is one hairy little elephant!,1,2
68.0,240.0,SequelMemes,4,Leaked pic of The Last Jedi script,0,2
224.0,300.0,gifs,5,Fish wants to be bought,1,2
408.0,240.0,worldnews,4,The Russians Indicted Friday Can't Ever Travel To A Country Friendly With The US,1,2
370.0,240.0,dataisbeautiful,4,"The number of titles on Netflix has dropped from 7,285 in 2010 to 5,579 today, but the number of TV shows has tripled from a mere 530 to 1,569",1,2
42.0,120.0,gaming,2,Taking the perfect photograph in GTA V,0,2
224.0,300.0,gifs,5,Fish wants to be bought,1,2
408.0,240.0,worldnews,4,The Russians Indicted Friday Can't Ever Travel To A Country Friendly With The US,1,2
370.0,240.0,dataisbeautiful,4,"The number of titles on Netflix has dropped from 7,285 in 2010 to 5,579 today, but the number of TV shows has tripled from a mere 530 to 1,569",1,2
42.0,120.0,gaming,2,Taking the perfect photograph in GTA V,0,2
701.0,300.0,The_Muelle,5,🚨 CONFIRMED 🚨 Hillary Clinton met with Russian agent during 2016 election.,1,2
201.0,240.0,Whatcouldgowrong,4,Let us rob this gas station,1,2
413.0,300.0,interestingasfuck,5,How to deactivate a cat,1,1
166.0,300.0,FortNiteBR,5,Air Drop render distance is waaay to small this patch. How am I supposed to see this?,1,2
147.0,300.0,ChildrenFallingOve,5,Now this is how you do a cartwheel.,1,2
125.0,300.0,AnimalsBeingJerks,5,Bird stealing fur from sleeping dog,1,2
50.0,180.0,aww,3,Fluffy Scottish highland calf,0,2
74.0,240.0,ImaginaryLandscapes,4,Engine Maintenance by Mac Rebisz,0,2
72.0,240.0,freefolk,4,If Sansa was a Baratheon.,0,2
204.0,360.0,funny,6,Tall German tourist using an ATM in south-east Asia,1,2
996.0,480.0,videos,8,How Billy Mitchell got caught cheating (and still denies it). By the same guy who created interesting piece about Todd Rogers.,1,2
315.0,480.0,OldSchoolCool,8,Caroline Kennedy walks ahead while her father carries her doll (1960),1,2
259.0,420.0,AnimalsBeingDerps,7,Following dad down the stairs,1,2
393.0,420.0,PeopleFuckingDying,7,"eviL terroRISt ""AbDUL"" BrUtaLLy sLaUghterS AMERIcaN PatrIot In brOAD dayLIGHT",1,2
335.0,300.0,harrypotte,5,All wizarding families are connected...Here's the most complete family tree of the Potterverse yet!,1,2
652.0,480.0,gifs,8,Doggo has mad skills..,1,2
211.0,420.0,PrequelMemes,7,Literally just a picture of Jesus Christ,1,2
60.0,120.0,educationalgifs,2,Ladybug demonstrates how its wings unfold,0,2
32.0,240.0,eactiongifs,4,MRW I check my post and see I've got 6 points.,0,2
320.0,540.0,pics,9,"Tree fell down in my street, my neighbour decided to create this masterpiece",1,2
167.0,420.0,ProgrammerHumo,7,What's your child texting about?,1,2
96.0,360.0,sweden,6,Cyberpunk Pressbyrån,1,2
165.0,420.0,StarWars,7,Now this is podracing!,1,2
77.0,240.0,polandball,4,"Capitalism at 20,000 Feet",0,2
260.0,360.0,nottheonion,6,"'This Must Be Some Mistake,' Says Snowboarder After Winning Olympic Gold In Skiing",1,2
23.0,120.0,AnimalTextGifs,2,"""Lets play fetch!"" [OC]",0,2
83.0,480.0,Bossfight,8,"Nas'taljah, Traveler of the Past",1,2
111.0,120.0,assholedesign,2,Oh thanks! Wait what...?,1,2
66.0,240.0,barkou,4,Couch to couch barkour. Look at that air time!,0,2
1593.0,480.0,europe,8,Today Kosovo celebrates it's first decade of independence,1,2
109.0,420.0,malelivingspace,7,My bachelor parisian studio,1,2
49.0,420.0,2healthbars,7,They're evolving,0,2
50.0,480.0,brushybrushy,8,Wild untamed brushies,0,2
652.0,480.0,gifs,8,Doggo has mad skills..,1,2
135.0,540.0,memes,9,This shook the foundations of my beliefs,1,2
320.0,540.0,pics,9,"Tree fell down in my street, my neighbour decided to create this masterpiece",1,2
42.0,300.0,EmpireDidNothingWrong,5,Ran into a legendary pilot today.,0,2
40.0,180.0,iamverybadass,3,I've already killed somebody,0,2
30.0,240.0,EarthPorn,4,"Abandoned pine plantation • Laurel Hill, Australia [OC] [2700x2160]",0,2
43.0,480.0,YouSeeComrade,8,"You see Comrade, capitalist pigdogs can't riot you if you riot them first (and then gulag)",0,2
201.0,600.0,MonsterHunte,10,This Cosplay is out of this world!!!,1,2
254.0,540.0,ColorizedHistory,9,"The Capture of William Joyce, aka ""Lord Haw Haw"" - Anglo-Irish Fascist politician and Nazi propaganda broadcaster in Germany, May 1945.",1,2
15.0,300.0,DesignPorn,5,Shanghai Natural History Museum,0,2
31.0,300.0,teslamotors,5,Parking your Tesla in the wrong spot,0,2
120.0,480.0,FellowKids,8,Blizzard with the epic banter xD,1,2
36.0,480.0,meirl,8,meirl,0,2
36.0,480.0,meirl,8,meirl,0,2
303.0,480.0,gifs,8,"The world has 14 foot high, 5000 lb fish Mola molas are awesome",1,2
16.0,60.0,standupshots,1,1 out of 10,0,2
40.0,180.0,iamverybadass,3,I've already killed somebody,0,2
18.0,360.0,Catloaf,6,Loafin' around,0,2
16.0,240.0,aww,4,True love knows no fences,0,2
43.0,480.0,YouSeeComrade,8,"You see Comrade, capitalist pigdogs can't riot you if you riot them first (and then gulag)",0,2
90.0,300.0,worldnews,5,"Pope Francis has reactivated the lapsed sex abuse advisory commission and announced new members have been appointed, amid criticism over his handling of cases. Vatican said survivors of abuse had been included in the group.",1,2
120.0,480.0,FellowKids,8,Blizzard with the epic banter xD,1,2
77.0,240.0,polandball,4,"Capitalism at 20,000 Feet",0,2
30.0,180.0,teenagers,3,We got food at the house:,0,2
47.0,120.0,nintendo,2,Found this mixed in with some of my father's box office stuff ... he helped run the event in Detroit ...,0,2
126.0,240.0,thatHappened,4,Teacher cancels exam because one kid likes the same music as them.,1,2
49.0,360.0,anime_irl,6,anime_irl,0,2
93.0,300.0,pics,5,Marijuana under an electron microscope,1,2
15.0,1140.0,Atlanta,19,Downtown from a red-eye.,0,2
50.0,60.0,CollegeBasketball,1,"This one’s for you, /r/collegebasketball.",0,2
69.0,360.0,oddlyterrifying,6,Your carriage is here...,0,2
30.0,240.0,EarthPorn,4,"Abandoned pine plantation • Laurel Hill, Australia [OC] [2700x2160]",0,2
81.0,420.0,funny,7,Britain prepares to go head-to-head with Space X.,1,2
13.0,180.0,greentext,3,Anon joins the military,0,2
372.0,540.0,videos,9,Right now youtube is deleting drug information channels. Channels that help educate and prevent deaths.,1,1
1593.0,480.0,europe,8,Today Kosovo celebrates it's first decade of independence,1,2
254.0,540.0,ColorizedHistory,9,"The Capture of William Joyce, aka ""Lord Haw Haw"" - Anglo-Irish Fascist politician and Nazi propaganda broadcaster in Germany, May 1945.",1,2
64.0,600.0,aww,10,Love this shot,0,2
134.0,480.0,ScottishPeopleTwitte,8,Neither can I.,1,2
12.0,120.0,PerfectTiming,2,This ref taking his job very seriously,0,2
19.0,180.0,outrun,3,Cyber Drive,0,2
23.0,240.0,interestingasfuck,4,Burn pattern from a downed power line,0,2
31.0,360.0,funny,6,little cute dragon,0,2
201.0,600.0,MonsterHunte,10,This Cosplay is out of this world!!!,1,2
69.0,540.0,funny,9,Ride the Dublin Escalator,0,2
16.0,180.0,Eyebleach,3,Caracal grooming his human,0,2
553.0,420.0,CringeAnarchy,7,Eating the rich.,1,2
205.0,660.0,HumansBeingBros,11,Helping kids have a great time even when the nation is falling apart!,1,2
20.0,180.0,arepuppers,3,This vvv goodgirl told some drunk guy to do a heck and don’t come in our apartment last night.,0,2
28.0,240.0,GamePhysics,4,[Battlefield1] Mini mishap,0,2
16.0,240.0,PartyParrot,4,This bird wants to party,0,2
30.0,120.0,WatchandLearn,2,How to Crack a Combination Lock With No Tools!,0,2
73.0,600.0,IASIP,10,Birthday card I made for my husband who was sad about turning 30.,0,2
21.0,180.0,meirl,3,meirl,0,2
28.0,240.0,gaming,4,Gotta Stay Positive :3,0,2
366.0,420.0,tifu,7,TIFU by playing on my PC with a PS4 Controller,1,2
46.0,660.0,comics,11,Abracadabra!,0,2
21.0,240.0,HistoryMemes,4,It's so big,0,2
43.0,120.0,PoliticalHumo,2,Let's give Russia a taste of its own medicine,0,2
110.0,300.0,gaming,5,Size of the Kingdom Come: Deliverance script...,1,2
15.0,240.0,EarthPorn,4,"Moonrise over the White Mountains from Mount Chocorua, New Hampshire [OC][3000x2000]",0,2
611.0,720.0,gatekeeping,12,Anti-gatekeeping on /r/military,1,2
23.0,180.0,StrangerThings,3,My new favorite character,0,2
69.0,360.0,oddlyterrifying,6,Your carriage is here...,0,2
49.0,360.0,anime_irl,6,anime_irl,0,2
93.0,300.0,pics,5,Marijuana under an electron microscope,1,2
15.0,1140.0,Atlanta,19,Downtown from a red-eye.,0,2
50.0,60.0,CollegeBasketball,1,"This one’s for you, /r/collegebasketball.",0,2
81.0,420.0,funny,7,Britain prepares to go head-to-head with Space X.,1,2
23.0,240.0,interestingasfuck,4,Burn pattern from a downed power line,0,2
13.0,180.0,greentext,3,Anon joins the military,0,2
372.0,540.0,videos,9,Right now youtube is deleting drug information channels. Channels that help educate and prevent deaths.,1,1
1593.0,480.0,europe,8,Today Kosovo celebrates it's first decade of independence,1,2
